"quote_text","response_text","relation"
"If you're not at serious risk of covid don't get it -- you don't owe anyone to compromise your health for theirs","But the propoganda and collaborative fear says I owe my health for the sake of others right now, ya know? It's something I've never faced before. But I'm 30 and healthy and don't go out in groups or to clubs or anything anymore and I was forced to isolate in one room the entire year for a family I nannied for. Didn't go a SINGLE PLACE FOR A YEAR. I want to feel like that was doing my part! But I had to quit my job because they wanted me to get the vaccine the day it was out and would never drop it. For people who work at home, it's an easy decision, yes or no. As a childcare worker I feel like I have no choice. But your input means so much, I hear you. Thank you.",0
"The protection is not “all or nothing” - it’s not 100%…but it is estimated at 96%+.  That means there will be breakthrough cases, but even then, the vax provides protection by drastically reducing hospitalization and death.","Is it safe to say that this 96% or 95% or whatever high number is now much lower due to the new variants? I still see 95% being thrown out and I cringe every time.",0
"Did you cry when Dobby died?","Now that you say it I haven't had any emotions since I got my first vaccine. Anytime there's a spot in my life where I would normally feel something I just keep hearing about how great Bill Gates is inside my own head. Pretty weird huh? Probably nothing...",0
"As of right now the new CDC guidelines say to quarantine for 5 days, if asymptomatic, followed by 5 days of wearing a mask when around others. I'd go off of your positive test date of 12/27.","But they aren’t asymptomatic….",0
"If you get it from the first shot it usually means you had the virus before. It can be up for 2 to 3 weeks","There is absolutely no truth in this unless you can source it.",0
"This page is now overrun with antivaxxers- ignore them, it will be fine. You don’t want long covid or to spread it to others. You will be fine.","The vaccine stops neither, you can still catch covid and suffer any ill effects, and you can still pass covid along despite being triple jabbed... Can you absolutely guarantee OPs safety? You can 100% guarantee nothing will happen? Any reasonable person would give both sides of the argument, not throw some childish 'insult' around and say to ignore people with a differing opinion",0
"Yes a vaccinated person can still spread the virus but only if they get it first. And with the vaccine you’re 90% protected so in the 10% chance you get COVID you can spread it. But there’s a 90% chance you don’t get it.

Other than that this has been around for almost a year now and if you haven’t gotten it yet nobody on Reddit is going to combine you…","Incorrect, the most highly injected jurisdictions currently have the most infections. It seems that injections may actually result in infections due to immune damage not prevent them.",0
"Have you tried taking antihistamines for several days in a row to see if it's the onset of seasonal allergies that coincided with your covid vaccine appointment?","I've been inside my house the entire time because I have anxiety issues about leaving. I've also never had allergies my entire life so I don't think it's that",0
"Im 16 and my parents are doing the exact opposite scaring me with misinformation and telling me that it would kill me or hurt me and mutate me etc,etc","the number of teenagers having heart complications, seizures, and other ""side effects"" from these are very high.. they are just trying to protect you. im not anti vax but no way would I encourage my child or teen to get these. The officials say there's no long term complications but real peoples stories and deaths say otherwise",0
"Why is this sub still active and not shut down? Everyday with the same posts by anti vaxx fucktards.","You’re a fucktard. And what’s the problem with just asking questions? Jesus you guys have a big stick up your ass.",0
"FWIW I was in the Pfizer trial and received both of my doses in September 2020, so I've had the vaccine roughly 6 months longer than the general population and no complications have arisen.","How do you know you didn’t get the placebo?",0
"It is *extraordinarily* unlikely that a vaccinated person died from COVID unless the vaccine didn't work for them","How are you still parroting this nonsense after all these weeks when the evidence to the contrary grows stronger every day...The rate of fully vaccinated individuals that require hospitalization after reinfection with covid-19 is 7% according to stats published by the CDC.The rate of hospitalized individuals in the general public is 3-5%At first that could easily be shrugged off as being related to the disproportionate number of elderly vacinees and their weaker immune systems.But now that so many people in all age groups have been vaccinated, the stats are still holding strong and we have seriously strong evidence that the vaccines aren't providing a significant reduction to the burden on our Healthcare systems.Add to that the fact that the edit: 1.351 variant (which is becoming more and more prevalent) is able to evade pfizer and moderna induced antigens and your statement it blatantly false.",0
"Your case has nothing to do with the effectiveness of the vaccine. Your relative was unvaccinated.

The numbers speak for themselves. The overwhelming majority (~95-99%) of deaths and patients in the ICU are unvaccinated. In fact, if it’s true that your relative couldn’t get the vaccine due to a health condition, you should be mad at the willfully unvaccinated for spreading this shit around. The more a population is vaccinated, the more protection there is for those who cannot take the vaccine.

Now cue, the misinformation trolls and bots.","Still I need the explanation in the case non vaccinated. I don't need to be reminded about the vaccine.

If he was improving, why did he got worse? Why did they wait too much for the documents when he had to do a surgery?",0
"It's a public health crisis not a private health crisis. As a society we value freedom so we give individual citizens the choice, but the expectation is that people will make the right choice. For the public health, get the shot.","""Public good"" is always how horrific crimes under communism are justified. There can be no public health without first achieving individual health.

You shouldn't have to suffer injection injuries to ""save grandma"" this is an inversion of rational thought.",0
"In Chile, it looks like 60% have had one dose, with 46% being fully vaccinated. Article states that vast majority of infections and hospitalizations are coming from non-vaccinated folks, who are unfortunately slowing down the end of the pandemic for everyone.Still, I think Chile's vaccine numbers should be nearing herd immunity, especially if they get some more people a second shot. They will have roughly the same vaccination rate as Israel, who pretty much has accomplished herd immunity. However, if you compare Israel's vaccine charts w/ Chile, Israel ramped up way faster and a lot earlier (which makes sense, because they started giving shots well before most countries)Israel hit 50% first doses on Feb 24 vs. Chile hitting 50% on May 24.Within a month or two, I would expect to see Chile's COVID cases and deaths start to plummet.But I hear you, as someone who got my shot too, I'd be really frustrated about the lockdowns. I think it's a balancing act where countries feel they've almost made it to the finish line, and don't want some variant or outbreak to ruin everything.","The UK covid numbers are concerning because their vaccination rates are very high and their positivity numbers are going up again. UK is 7th in the world in vaccination rate and it's going up. Chile's vaccination % numbers are higher than the UK, just barely.",0
"They recommend only 60 and above take Oxford here in AustraliaGet better soon","That's specifically due to the higher risk of blood clots in younger people. It's not to do with anything else.",0
"If doctors rule out myocarditis and other conditions, it’s likely a short term immune system response and/or anxiety. Nothing to worry about.","Some of us have had these symptoms for many months. 5 months for me.",0
"So I'm positive it was injected into a vein.","Doubtful. The needle likely went through a vein or artery or capillary in your subcutaneous tissue on its way into your deltoid.",0
"So you’re cool with just surrendering your freedom of choice for convenience? You’re the exact kind of person the government loves","I don’t agree with it at all! I’m just stating the reality/outcome. It’s not my fault we have a fascist government.",0
"Eventually, once the FDA does it’s full approval, you’ll be required to. Your employer will be forced to mandate it by the government. Why not just get it over with. It’s ridiculous, but inevitable.","So you’re cool with just surrendering your freedom of choice for convenience? You’re the exact kind of person the government loves",0
"Assuming you get an active dose, it will make you sterile. Do not get this thing if you value your health.","I have heard this multiple times but have not spoken to a single person who can tell me “yes I took this and I can no longer have children.” That is what I am looking for. I’m tired of all the speculation and article tossing. I want a person to actually tell me that was their experience",0
"Get your parents approval first - they love you and care about you.","How should he do that if they are strongly against it? He’s old enough to make that decision by himself. And he’s doing the right thing.",0
"This is a normal reaction that I think is a lot scarier when you haven’t dealt with severe anxiety or don’t know anyone who has dealt with severe anxiety. The covid vaccine along with other vaccines can cause your brain to panic because building that immunity basically tells your brain that something is wrong. You panic, your heart rate increases, you can have heart palpitations, muscle pain, etc. because that anxiety can cause physical symptoms. Myself, and others I know with anxiety, have had periods of time where that panic essentially doesn’t go away from days to months at a time. It is really terrifying when you first experience it but as long as your tests are coming back normal then that’s likely all it is. I got my first covid shot and after six hours I began experiencing that same exact thing. Even if you don’t typically deal with anxiety, this can happen. It’s not abnormal, I know multiple people that have gone through it even though they don’t have anxiety.","Just because its not abnormal doesnt mean its ok. It camt be good for the body to have your heartrate explode to 168bpm.",0
"You’re young and did not need a vaccine. All of this could have been avoided with a little will power","I'm an adult who can make my own choices to protect my own health thank you very much :)",0
"The spike protein has been shown to accumulate in the nucleus in some studies.","You have no idea what you're talking about.",0
"I’m surprised your OB said all three vaccines cause clotting. The data is mixed on the mRNA vaccines in relation to clots, unless I missed some recent news. Also, the American College of Obstetricians and  Gynecologists issued a strong statement in favor of boosters when the Pfizer booster was approved in early Oct “ACOG recommends that pregnant people, including pregnant health care workers, receive a booster dose of the Pfizer-BioNTech COVID-19 vaccine at least 6 months following the completion of their initial Pfizer-BioNTech COVID-19 vaccine series.” They haven’t yet updated their statement to include anything about Moderna or J&amp;J. I would definitely get a second opinion from an OBGYN, especially in light of the political comments she made.","The covid spike protein can cause clotting, so anything that makes your body produce that, it's possible. But always higher chance with Covid itself afaik.",0
"Here is a link where you can predict the chances that you'll be hospitalized if you catch covid. Average hospitlization will cost, what, 20k? So your choice appears to be a) get a vaccine and feel ""off"" for a day or 2., b) live in your parent's basement so you won't get covid at all or c) catch covid and have an 5-10% of being hospitalized, where you'll have to shell out thousands upon thousands of dollars. Not to mention, I know plenty of single people who won't date people who aren't vaccinated. And not just because they don't wanna get infected by you. Who the hell wants to date someone who only thinks of themselves? Who won't take a shot to help protect grandma?","What’re you talking about. You can still spread covid with the vaccine. It’s not selfish to not be vaxxed. Some of us are masking up consistently, avoiding gatherings, taking zinc, vitamin C, D and whatever else to help our bodies handle it. Some people have illnesses that these vaccines can cause reactions in and neither covid or the vaccine would be very fun to get.What I do see is plenty of vaccinated people walking around and gathering in large quantities without masks. When clearly the data says it’s still able to be spread. Kind of selfish if you ask me.",0
"Just curious. How did you prep pre and a few days post vaccine? Did you extra hydrate with water and increase your animal protein intake? I have notice in my love ones and also myself it made a HUGE difference.","I'm not sure if you saw my update- but it wasn't something that could've been avoided by diet unfortunately.",0
"Here they all go again downvoting me , y’all are just petulant children afraid of needles so you insist on being a plague rat.","You sound just like those people calling others ""lab rats"" you're the other side of the same coin.UPDATE: Just got banned from this group, the mods are anti-facts...",0
"It's not that deep to get it and get it over with. This whole making it an important decision thing that people out there do is ridiculous. It's a painless prick in your arm, not a billion dollar merger deal.","It is an irreversible decision that Alters your immune systems function in ways we don't fully understand. It may also cause a stroke or heart attack.",0
"You should call your doctor and drink lots of water. Risk with this vaccine is EXTREMELY low. If you develop myocarditis it’s acute and easy to treat. You’ll be fine, I absolutely promise.","You cannot absolutely promise this!!! What a lousy response!",0
"I enjoy Reddit but have been meaning to leave this sub for awhile BUT actually came back to share my positive experience today, so glad to see your post. This sub is the reason I almost didnt get my shots at all. High health anxiety + automimmune disease + reading the overwhelming HORROR stories only made it worse.  It made me forget that my entire immediate fam got vaxxed and no one was “ill” for more than a day…that my circle of friends got vaxxed and no one was hospitalized or got extremely sick at all. That the MOST common symtoms are NOT super high fever and constant vommiting. I got both Moderna shots and guess what - only had a sore arm and a heachache.  Luck? Or maybe cuz I hydrated well for two weeks, slept well, ate healthy and meditated? I believe that ppl have bad reactions and that’s unfortunate.  But Im THANKFUL that it didnt change my mind. There are so many factors: genetics, LIFESTYLE (some ppl don’t sleep well/eat well or take care of themselves), and eveyone’s threshold is diff (your idea of a sore arm and fatigue is diff from mine). Ppl need to talk to real doctors, actually read the trial data and make grown up decisions for themselves.","The lifestyle correlation isn’t true though. I have noticed this thing where some people like to correlate their healthy lifestyle to a chill outcome.Anecdotal, but I’ve observed among myself and people I know who have been vaccinated, that the very WORST side effects were mine, and I am by far the healthiest person in my group of people. (Just severe flu side effects, but it’s the sickest I’ve been in decades) I am much healthier than an average person in the general public. I feel I can say this with confidence, as I am a fitness instructor, and my livelihood is my health. I work with people’s bodies and have a fairly good feel for the “average” persons physical fitness. Peoples bodies are all so different and complex. Just because *you* happen to have a healthy lifestyle, and had no side effects, does not prove that overall, healthy lifestyles = no side effects.  Correlation is not causation.",0
"You got covid twice and with all that protection? Either you're trolling or you're not taking this pandemic very seriously.","She never said she did homie. She explicitly stated that she got it once and is now wondering if she might have it again.",0
"Its because no amount of upvotes or pats on the back is worth your health. People are dieing from this shit and youre over here whining about not having your ego stroked, or some kind words. Take some responsibility for your choice, this is real.","What are you talking about??? Whining about not having my ego stroked????? YOU KNOW WHAT ELSE IS SERIOUS? AN AIRBORNE VIRUS.  WHAT?!",0
"Assuming you get an active dose, it will make you sterile. Do not get this thing if you value your health.","That is completely false. There is no plausible reason, no medical or scientific mechanism, for this vaccine to interact with a woman's reproductive organs or have any interaction with an egg that's been released or fertilized. There just isn't any way for a person to go sterile from this vaccine. Also, OP, you might want to consult a doctor about your decisions regarding your health and family planning, otherwise you're going to have to fact check each one of these lies. Asking for sources is the best way to silence these fools. They either have none or they post sources that are conspiracy based and not science backed.",0
"I think anyone who would base a decision about their own safety and health on resentment about being told what to do, is emotionally a child, and has a lot of growing up to do, regardless of the number of times they’ve been around the sun. I don’t want to insult you, but how bullied or pressured you feel about it has no bearing on whether it’s a smart choice for YOU. If you end up with it, with complications or serious illness, or end up infecting someone vulnerable and killing them, do you think it will matter to you one bit that you stood up to the pressure and didn’t get vaccinated?

Real maturity and strength lies in making good choices and doing the best for yourself and people you care about, regardless of peer pressure either way.","You know anyone can take these shots right? So if these vulnerable people you speak of have access to these shots. So they are protected right? So why does it matter if someone isn’t vaxxed if your already vaxxed up?",0
"The first shot was hell, I’m absolutely not getting the second.","For most people who have a hard time with the first shot the second dose is easy. But it probably won't do anything. This is because you almost certainly had the virus",0
"Millions of people in the world have received the vaccine without any issues. 99% chance you'll be fine.","Millions of people in the world have gotten COVID-19 ....the sickness, without any issues. 99% chance you'll be fine.

Wow what a coincidence!",0
"I downloaded Vaers data this morning. There are 460,865 reactions reported, including deaths, and that's through last week.","antivaxxers been busy…y’all do know that VAERS is self-reported data?",0
"I love how antivaxxers on this sub always spew out a ton of false information and then they end it with “I’m not even antivax.” Where’s your proof of all these claims?","Labeling people who are hesitant about this particular vaccine with the “antivax” wrongthink label is not helping. I am not “antivax”—I’ve gotten vaccines before, and I am not entirely opposed to this one either, provided people are allowed to make an informed decision for themselves. Vaccines are a wonderful medical miracle (I shouldn’t even have to say this). But not allowing people the space to question something that they are being pressured by their government to apply to their bodies (regardless of their own personal risk assessment) is only making people more hesitant. Science is not something to be “followed” it is something to be questioned. The more people censor, shame and namecall others for questioning this vaccine or for reporting on the side effects they are personally experiencing (or in many cases SUFFERING from), the more it looks to anyone with an even remotely skeptical mind that something suspicious is going on, *whether it is or is not*. Want to be trusted? Then be transparent, patient, understanding and *tolerant of questions and skepticism*. Far too many advocates of this vaccine are not exemplifying such qualities. Any other approach and you make yourself partially responsible for vaccine hesitancy.",0
"Don't forget this is the same industry that lets people die because they can't afford insulin.","Insulin is free in NZ (well other than the $5 Prescription fee). So no that does not apply here. It is however the same industry that makes paracetamol, ibuprofen, and all the other lovely pain relief drugs ........... oh wait a minute ............. they make ALL medicines !!",0
"why post now then","Imagine posting about being vaccinated in a group called CovidVaccinated. This group is not exclusively for reporting side effects.",0
"Maybe you should get one a month? Seems a little excessive but it is for the greater cause.","For the greater good!

I will never take the jab.",0
"Its hadn't got through medical trials","This is false. Every vaccine went through trials before being approved for emergency use.",0
"Honestly, the best thing you can do is to make an appointment with your physician and discuss your concerns. Only your doctor knows your specific health history. Do not listen to pseudoscience and misinformation that you read online. Social media is not the best source for information on making personal health decisions.","Your doctor is not allowed to say anything bad about the shot or hasn't looked into it because he doesn't want to know. Do your own research. The High Wire dot com for today's show is a great place to start. Del recaps and explains a lot that he has learned over the past year.",0
"I work in the public health lab in California. We get probably 3-5 vaccine breakthroughs a week so it definitely isn't rare like a lot of people think. I hope you feel better OP","20/month out of hundreds of thousands falls within the “pretty rare” definition to me. Numbers put of context are just numbers as you can see here and on the media",0
"Fully vaxxed.  In line to get booster.  And I believe that it provides a great amount of protection, Bc I understand the data and I understand science and the scientific process.  But I’m still not going anywhere, again bc I understand the current science and data. I’m in lockdown.I think people like you should definitely *not* get the vaccine…just play Russian Roulette since you’re so sure of your understanding of the science, and so dismissive (and disparaging) of those of us who are just trying to be careful.","Listen, not an anti-vaxxer or conspiracy theorist. I believe COVID is 100% real. I take my personal precautions but this vaccine needs more longitudinal studies for me to be more convinced/enticed to get it.",0
"From my understanding, the shot just reduces the severity of the symptoms of the virus. It doesn't mean you're immune or that you can't catch/spread it.","So why is it being mandated?",0
"I'm vaxed, (1st shot had slight aches on my shoulder where I got shot, 2nd didn't feel anything), but after a few months the side effects kicked in, I feel fatigue all all the time and have muscle aches on upper body. I'm in my 20's and light exercise daily, but feel exhausted and have muscle aches all the time, my body feels like I've aged by 5-10 years or so...I can see both sides of the coin. Where people do want the vaccine/booster and those that are skeptic and don't want to be told/forced to be vaccinated. I see vax blame unvax for the continuing spread of the virus and I see unvax blame vax for going  around/travelling unmasked in large crowds/concerts/parties/etc and catching covid then spreading it... There seems to be a divide in the US and people want to blame someone... kinda sick and tired of this game, but all I can see that only time will tell and how it plays out. In the mean time, I'll stick working from home, play my games at home, and go to the grocery store with my mask on till this all blows over. Also, I haven't been sick once since staying home on early 2020. I don't mind the government/companies informing us to get the shots/boosters, but I don't like how some are even trying to mandate/force us to take it... it kinda takes away from what individuals believe in/freedom of choice. Kinda like how Obamacare/ACA played out, why penalize those that don't want it?!I may get the booster, but I feel like a guinea pig, I feel like the vaccine is still in it's experimental state and All 3 major companies as stated early in this thread are racing trying to get out something, even if it's not 100% effective. I will probably wait till others get their boosters and if there are any side effects and the reviews are out, then decide if I should get it or not.","How do you know it's from the shot? I have this too but also had it before I got vacced",0
