"quote_text","response_text","relation"
"Why do some people in this subreddit have such a boner for novavax but hate the others? I’ve noticed several comments by thinly disguised antivaxxers on here saying they’d get novavax over all of them. Any idea why?","I got Pfizer but studies show that Novavax causes less side effects and is actually more effective against covid variants. Lots of us still have vax-hesitant family who are fine with tetanus shots but don't trust mRNA technology. Frankly I can't change their minds but I'd rather not bury them. Plus ...Variety is the spice of life. Chill out.",0
"I am a trans woman and I haven't got pregnant since taking the vaccine.","I wonder why.",0
"It's legal. Unless you have a medical exemption, in which case they have to make a reasonable accommodation (like requiring you to wear a mask in common areas) or they run afoul of the ADA.

HIPPA doesn't apply, at all.","It's actually not legal, it also lost in the Supreme Courts and the government is trying to force it. Therefore you can sue for discrimination, and for being forced upon you, which is preventing you from having a way of life and sue for harsh treatment because they basically are saying you should be homeless. Get it in writing that they want you to be vaccinated which is a medical treatment and sue them. You will win because the surprise court also ruled it as not legal. You will not find documentation that says its legal anywhere.",0
"It is a no brainer if you've had covid. You don't need the shots. Immunity is lifetime, anyone who says differently ask them why the polio vaccine still works if you got it when you were a child. Also, people who had covid are 2 to 3 times more likely to experience adverse reactions and there are some seriously horrific adverse reactions going on, like death for example. Also, graphene oxide is in the jabs - straight up poison, so there's that also. But you may want to watch this video of a doctor testifying in a senate hearing that natural immunity is real, is better than the jabs and that covid survivors have more reactions to the jabs:","Do you have any proof or link or something about the fact that people who have had covid have worse side effects of the vaccine? Because I’ve had Covid and I’m really scared of the vaccine side effects so I would like to learn more about it whether it’s really true.",0
"its a relative risk. original the infection rates for kids where very low. so if you have to vax 1000 kids but would expect only 10 kids would get it anyway, the risk for the 990 kids doesnt outweigh the benefits. now with omikron you see the highest infection rates with kids and due to increased R and spreading its now more like WHEN you get - not IF you get it. Therefore the effect of protection far outweigh the risk of the vaccine itself.","It’s not about cases but hospitalization and death. They said they’d need to vaccinate 1 million children to save one life. If those 1 million vaccines kill a single child it would be ill advised. The vaccines also cause myocarditis and pericarditis more than 1 in a million in teens. We don’t have child data because the study was way too few participants to know the safety, according to the FDA in response to the Pfizer trials.",0
"How would it be possible to organize such censorship on a such a huge worldwide scale? In the end, each country's own low level experts would continuously blow the whistle on this. Not all countries would be conforming and we would've heard a bigger outcry by now, just saying","Global media has replaced local media so it doesn't need to be mass censorship it only needs to be done in two places at this point, the media and the organisation that advises governments on these matters the World Health Organisation. Have you seen the mass protests happening globally? There is a huge outcry but it's not being reported on  as much as we would expect.",0
"I'm NEVER injecting anything that's ""required""... Nope... They can jab my dead body, I just hope they (whoever tries to force me) are vaccinated for lead.","I mean. It wasn’t required for months now. So what is your next excuse?",0
"I had similar symptoms a few months after the first shot. My heart rate shot up to 170 and I wound up in the ER three times. Prescribed propranolol. I’ve been testing for causes and my cortisol is high. Super weird. Might have Cushing’s but not 100% sure yet. Anyways. Got a booster. Seemed to flare my new cold sore problem, arm was super sore, but so far, no other issues.","You got the booster? After that? Are you super high risk?",0
"“Experimental” ? What are you saying? Dude if you did any real research you would understand it’s not but keep going.","“Dude if you did any real research” if YOU did hardly any research at all, because it’s plainly written in black and white ON the fda website when you search for the emergency use authorization letters, that these are “experimental vaccines not approved or licensed by the fda for any indication”",0
"Everyone says to ask your doctor. But your doctor has to recommend it by order of CDC.. So hard to say what you should do.","That's not true. Doctors do not need to rec. a vaccine by order of CDC. Doctors read the evidence for vaccines- and as doctors, need to rec. what evidence shows…",0
"Not at all! My life and that of those around me has noticeably gotten better since we all got vaccinated about a month ago. Theres a lot less worry, a lot more parties, and almost no side effects among me, my mother, father, brother, sister, Grandmother, Godson, friends, coworkers and church family.","So, in your experience, getting vaccinated helped you return back to normal life? And if so, would you say that’s a reason why you claim your life has “noticeably gotten better?”Genuine questions, btw. Not trying to be confrontational.",0
"Biden Administration is lying. Under any other normal circumstances at least not until some long term studies conclude. Like 5 years maybe. Under this EAU I read earlier this year it should be no sooner than spring 2023. Because the Biden Administration has continually pushed misinfo, suppressed truth, censored opposing experts, and used bribery and intimidation to coerce people into accepting the vaccine, the statement about approval in 2022 is another bold face lie. He cannot speak for the FDA. The FDA would not let him. Fauci can't speak for them either. Biden is a troll, using manipulative actions to increase vaccination numbers. Likely because he is being rewarded or threatened to do so.","To be fair, I really don’t think Biden understands much of what is happening here. He is the perfect vacant sock puppet for the ones really controlling the strings.

I personally like the guy in an “awww” sort of way. I voted for him like I would vote for a cute puppy in the Cute Puppy Contest.",0
"If you think that's bad, you should see what can happen to you if you get covid.","Statistically, covid is mild for most people.",0
"THESE ARE NOT NORMAL SIDE EFFECTS!Do you have chest pain when you get your flu shot? Tetanus? Hepatitis A/B? Rabies? Smallpox? Measles? These need to be sent back to the drawing board.","When was the last time they vaccinated this many ADULTS at once? Probably never. Guess what adults are prone to? Anxiety and the related symptoms, where kids don't give a flying fuck. Chest pain can be a symptom of anxiety and if all heart tests come out fine and you still have it than its either muscle or anxiety related.",0
"Edit: Pfizer- I got my first shot end of October and have had a horrible eye muscle twitch/spasm that is super uncomfortable, I’m still having brain fog, nausea, stomach issues, had a rash on my arm, headaches etc. I’m 1000% positive it’s from the vaccine and hate when people say it’s not. I really wish the lower eyelid muscle spasms would stop because it makes me look like a freak :(That said, I’m getting my second shot next week and am super worried about the side effects getting worse than I’m already still dealing with, I’m very small and my body is super sensitive to EVERYTHING (I can’t even drink green tea because my caffeine sensitivity). Wish me luck…Edit 2- I have also been having tinnitus off and on in my right ear, I see others are also experiencing that. It’s not constant for me luckily but comes and goes…","Why would you get a second shot if you are convinced that your first one caused those things?",0
"Lots of different factors come into play and need to be considered when basing your medical decisions on what is known about the myocarditis risk. The answer also depends on the datasets used.It's important to remember that in those who do get myocarditis, 95% resolved with rest and are mild. In the Israel study for example, men aged 12-29 were 4 in 100,000. So non-mild myocarditis would have been 1 in 500,000. When considering this data in relation to your medical decisions you should consult a doctor.Things to be weighed are this risk vs your risk of getting covid, which is almost guaranteed at this point, and your risk of long term complications or myocarditis from getting covid etc.It's a difficult statistical game.","My risk of developing serious complications from the coronavirus as a young, thin, healthy male is very low. My risk of being infected with the coronavirus is also very low in general. Especially due to my lifestyle, like working from home (and loving it), having a small network of friends, introverted hobbies and actively wearing masks, my risk of being infected is very low, perhaps near zero. My risk of developing serious adverse reactions to the vaccines are also very low. However, when I take the vaccine, I intentionally expose myself to that risk, and I am guaranteed that risk. On top of that, the vaccines aren’t even that good. They are not some magical guarantee of immunity, and aren’t as effective as one would expect from a vaccine. On top of that, 2/3 of the vaccines that have been available to me, are now no lingered offered to me because the risk profile is too high. It’s not exactly tempting.",0
"Well, side effects won’t likely kill you. They might cause you to suffer just enough that you wish you were dead. My worst side effect is probably ice pick headaches.

Covid can 100% kill you.

So, really it just boils down to which do you want? Vaccine with its potential side effects or Covid-19.","The chances of it killing a healthy person are less than .001%.",0
"Obviously a fat troll post but it is true that vaccine passports do approximately nothing","not a trollpost",0
"I swear I come to this crap subreddit and see side effects left and right, but in my neighborhood and city for that matter, there hasn't been any people that got major complications. People at the office and school reported a fever at worst. Either the vaccine is only targeting Americans or y'all lying.","Yep you caught us! We're just here for laughs....",0
"Better not to get it. Variants will continue and those who have received MRNA will have weakened ability to fight it without continuous boosters","Can you explain this some more? Some of my family members have made this claim, but I don't see how the vaccine could give you weakened ability to fight variants as opposed to not getting it at all. I know the vaccine's efficacy wanes over time, but wouldn't that just make it ineffective, not harmful in terms of the ability to fight variants?",0
"People your age are suffering with the delta variant. Get that vaxx.","Umm suffering how?",0
"You're far less likely to get covid if you're vaccinated, meaning you're far less likely to pass it because you didn't get it in the first place.","Wrong, it has been proven over and over again that vaxed people still get and pass covid. Sorry the government lied to you and you ate the bullshit.",0
"You aren’t the only one. I’m in the military and am still on the fence about this whole thing. I either get it or face a discharge. The lack of long term studies as well as reading and personally knowing people getting side effects is what’s stopping me. The science may be there but I’d be pretty pissed getting a serious side effect such as myocarditis from something that was forced. I had covid 3 weeks ago and had no symptoms, as well as no lingering side effects from it. My natural immunity as well as staying in pretty decent health is also what deterring me. Maybe I’m lucky.","It is very rare - I have had cancer twice and am immune-compromised so I was not really sure about this. My doctor friend insisted as the long-term effects of the virus are worse so I did - I had a mild headache for a couple of days then nothing. I hope you go ahead and get it for your sake and for your family.",0
"I got it 2 months after I got my J&amp;J shot, basically zero symptoms, hangovers are a million times worse than my Covid experience. Imo, much better than being boosted a million times and still most likely catching it. I'm happy that the vaccine made the virus into a puppy, I got over it, now I don't have to think about boosters and worrying about Pfizer or Moderna destroying my heart.","The risk of getting heart damage from Covid (even if vaccinated once) is still much higher than getting heart damage from mRNA vaccines.",0
"Have a look at this thread and the study it links. It's a preprint study suggesting myocarditis/pericarditis at a rate of around 1 per 1000 mRNA vaccinations in Ottawa.","Wrong again. The study — which was preprint, meaning it hadn’t been peer reviewed — has been withdrawn because the authors admit their numbers grossly inflated the rate of myocarditis.",0
"I think its only fair that you tell your partner that you got vaccinated.","Jw..what makes it unfair if they don’t?",0
"It is a tough decision. I guess you need to look at your risk factors. I developed nerve damage (dr saying small fiber neuropathy) and have continual numbness and weakness from the 1st vaccine. Refuse to get the second. But there are serious and long term risks of getting covid also.","No there aren't.",0
"Why dont YOU show us a data that the vaccine is dangerous instead of spouting off baseless conspiracies and calling everyone sheep? Find a peer-reviewed study that shows that the vaccine's risks are greater than its benefits, AND that its worse than getting COVID. Go ahead.","What the baseless conspiracy? What have I said that can be called conspiracy? I have given evidence that u can't refute. That means it's not baseless.

I don't need a peer review study. That's not the way precious new vaccine and drugs are handled. When there's reports of people dying from a new did we don't wait for double blind placebo prospective studies before we stop the new drug. We stop it and then look into it.

Also there are no such stories for the vaccine.",0
"A discussion is not supposed to put someone's feelings into consideration, you ask a question and you get an answer. The quality of that answer is measured by you, upvote and downvote accordingly... I always downvote people that make getting the vaccine or not a political issue which is unfortunately many.","I think we might just fundamentally disagree on where empathy fits into a discussion, which is okay - my primary point is how much this group has shifted. Other groups related to illness often are more encouraging, as this one once was.",0
"What are the odds of dying with Pfizer? Aren't Pfizer and Astro the same ""science""??????","Nope. The Astra Zeneca vaccine is a different sort of vaccine than Pfizer or Moderna. It's called a viral vector vaccine.",0
"So the vaccine doesn’t even work? I’m not an antivaxxer (I’ve already had one shot), but I don’t understand what the point of a vaccine is if it doesn’t work.","It works, just not 100% of the time.   Time will tell.",0
"Sounds like pleurisy. I've got an immune system disorder and lockdown last year had me stuck in a mouldy house all winter so I ended up in hospital 5 times with pneumonia and pleurisy, twice already so far this winter. Basically it's lung inflammation, usually from a respiratory infection, sometimes autoimmune diseases. Wouldn't surprise me since the vaccine gives you a dose of it if you already have poor health.","See I thought that could have been it, but breathing isn't really an issue for me. :/",0
"Curious about why youre stoked?","Um…my body has developed immunity to the virus that causes COVID-19 without me having to get the illness because I got the vaccine. Stoked! I’m going to assume good intent in your question and hope you are just being curious and not baiting me…",0
"JnJ seems to offer more protection vs variants. But if you're not a high risk demographic,  why bother?","I’m Canadian, it’s needed to engage in society. I’m currently unvaxxed as of now but I don’t know how much longer I can go on with this.",0
"Natural immunity is the only way out.","while it is probably helpful, it is not the only way out. vaccine induced immunity is also needed.Edit:jesus i love this subreddit, bunch of antivaxxers lmao",0
"Another fake post by someone with little to no Reddit history. This sub is littered with these. So damn obvious.","What do you mean fake lol? I don’t use Reddit much and I’m literally asking a question how is it ‘fake’",0
"Consult different doctors, heart problems a real thing,  only get vaccinated when you are 100% sure it won't effect your heart","The heart effects from the vaccine are mild and temporary. If you have chest pain following a vaccine, get it checked.However, remember that the virus can do everything the vaccine can do, just way, way worse.",0
"The chances of it killing a healthy person are less than .001%.","You are delusional. My nephew just died from Covid. Healthy, fit and unvaccinated. He was 20 years old.",0
"It’s incredibly rare for any vaccine to cause long term side effects. Almost all side effects show up within two weeks, when they do occur. What are the negative experiences you’re referring to?  I’m in Canada as well. I believe the NACI which is our vaccine committee, put a great document explaining mRNA vaccines any risks. A covid infection can be absolutely deadly for immune compromised and elderly people. A vaccine would drastically reduce your ability to spread covid to your loved ones. I’m fully vaccinated, as is most people in my life (family, coworkers, friends) I’d be happy to answer any questions. I did not hear any negative reactions from any of them, save for expected side effects.","""any vaccine"" polio, mumps vaccine etc that most people are used to as ""being rare to cause long term side effects"" are not experimental vaccines like this one. it doesn't even make sense to lump them in together. they are also not mrna vaccines. the inventor of mrna type vaccines himself says this vaccine is not safe. this vaccine hasn't even been out for 2 years, there's no way to claim it doesn't have long term side effects, that's just a lie. no one knows, not you, not me. even drugs that make it out of experimental trials and get approved, some of them get pulled as more long term effects are discovered down the line, eg. a stop smoking drug was recently pulled from market here bc it was linked to cancer. &amp;#x200B;cdc said today that vaccinated can carry more viral load that unvaccinated people and doesn't affect your ability to transmit virus at all. if you weight your risks and benefits (as a young person unless you have a serious illness you are probably at 0 risk) to getting the vaccine do it for yourself vs. ""to protect others"" since it seems the vaccine does not protect others and actually increases transmission of the virus.",0
"Why did you get boosted? Your demographic is literally one of the least effective by it.","More protection from infection especially with Omicron breakthroughs in people who got vaccinated earlier.",0
"Y'all need to look up the definition of a vaccine, this experimental mRNA modifying jab is no vaccine.. The CDC even states now on its website that it has a 75%-85% efficacy.. If it were a vaccine, that would be the worst vaccine in history","The flu shot has even less.",0
"Yes. In Israel rn most sick are vaccinated","Is that true, I really don't know anymore there's so much misinformation on vaccines being good and vaccines being bad.",0
"Assuming you get an active dose, it will make you sterile. Do not get this thing if you value your health.","Yeah? Then how come I know of someone who got pregnant after the covid vaccine? BS",0
"In my opinion, they will not try to eliminate the covid virus, they will replace the flu shot with it. Next thing you know is you have to take their vaccine/booster every year. Voila! Somebody makes a lot of money at other people's health expense. These are in my opinion only.","You realize that’s literally what we hope for right? The genetics for the Spanish Flu are still found in the seasonal flus that pass around every year. There isn’t an elimination or a magic cure. People who think that’s the case then go all nutso and antivaxx are the same exact people who know zip about how a virus works. They commonly don’t even seem to realize there are many different types. They sure do scream loud though.",0
"My wife’s booster hit her like a truck too. It was so bad she said she’s never getting another one and she’d rather have Covid. I was like uh, no.","Honestly, I had covid and it was way easier than my sisters reaction to the booster. Most cases are mild, obviously some are not. But most are.",0
"Covid vaccination creates inflammatory proteins - morning after pill is very high dose progesterone which can be inflammatory and clot producing. You do the math!","This person seems smart - i’d listen to permaban MD",0
"When will people learn that being vaxxed doesn’t mean you won’t get the virus. Just like before covid there was still the common cold and flu, stomach viruses/bugs all sorts, if you don’t wash your hands after going to the bathroom and before eating or being in close proximity to people that are ill, you’re going to get sick at some point. Not trying to be harsh and I hope you make a swift recovery. It’s just common sense.","It's ""common sense"" that vaccines don't actually protect you from catching the virus you were vaccinated against, c'mon guys, what are you thinking. lol.",0
"If the chest pain gets worse then see a doctor. Some young men are getting heart issues that require medical attention as a side effect of the mrna shots. Especially if you had a weird taste in your mouth after the shot. Seems to be a sign that they missed the muscle and injected you intravenously.","It's not a pain, more like an ache. And it's not constant, it's kind of random. And I do not have a metal taste.",0
"No issues you would be fine!","How do you know this? Did you do any scientific studies with enough data to conclude that? The vaccine is new and many problems can evolve in the future. Remember Zantac? A heartburn drug soled OTC in pharmacies for decades. Well, guess what? It turns out the the materials used are known to cause cancer which is why it’s withdrawn now (it’s back now with a new formula).",0
"News today said J and J is not effective against delta!","It didn't say ""not effective""!",0
"It doesn't matter if you are vaccinated or not. You can still spread the virus. Furthermore, with the new varient you are more at risk for complications having been vaccinated for the past strain. The vaccinated are spreading the virus more as they believe that they cannot catch nor spread the virus anymore and are not wearing masks or distancing any more.","It does matter if you are vaccinated.

Vaccinated people are much less likely to get covid and less likely to spread it.

If they do get a breakthrough infection, they are likely to recover faster and therefore are contagious for a shorter period of time.

They are also much less likely to get seriously ill. Very unlikely to get hospitalized or die. Which means they won't take up hospital resources.

It's the UN-vaccinated that are causing large outbreaks and spreading the virus more.",0
