"","quote_text","response_text","relation"
"2183","...Course there is very little stopping faith and science going together, as long as the Faith is fairly vague, but even then I see it having a hard time without stepping on the toes of science in anyway, especially if we consider possible future science as well.","True.",2
"3758","I see the publication of Darwin's Origin of Species to be a watershed event that permenantly established the single common ancestor model as the foundation of evolutionary biology.","Could be.",2
"4777","The comeback is that science just hasn't found the proof yet.","Well, yeah, if science hasn't provided an explanation for a phenomenon, then all we can do is shrug and submit grant proposals.",2
"7806","Actually, the Mormon seminaries aren't ""on the grounds,"" although they may be on an adjacent, privately owned piece of property. It would be unconstitutional for the seminaries to be on property owned by the school district. The children go to the seminary on released-time, which has been found to be constitutional (although I don't see how).
 
 Pertinent decisions about religious instruction and schools are:
 
 McCollum v. Board of Education (333 U.S. 203)
 Zorach v. Clauson (343 U.S. 306)
 
 McCollum found that religious instruction on school property is unconstitutional, while Zorach found that ""accommodating"" religious instruction by releasing students from school for that purpose was not.","Yep thats true.
 
 There in separate buildings but right next to each other.
 
 I see it being about as attractive as a crack house next to a school with a revolving door in front.",2
"72811","Materiatists: say genes get passed down through the generations.","And since this is inarguable, empirical fact, we're fairly safe in saying so :)",2
"40141","Creationism starts with a conclusion, and finds data to support it. According to the scientific method, one is suppose to look at data, and draw a conclusion from it. Therefore, creationism is not science, and needs not take any scientific consideration. The end.","Been saying that ever since the first time I heard about creationsism.",2
"5001","Is there really a difference between this and the theory of spontaneus generation?","Yes. Only the ignorant think not.",2
"2405","On the other hand, I am not suprised that Marc lives such a short distance away from where it is being built.","My thoughts exactly. :p
 
 Know your audience as they say........
 
 Waxy",2
"12952","for the sake of this topic, would it be ok if we borrow the word evolution from your biologist for a minute?","Well, I can't stop you. But if some creationist says ""But in that other thread you said evolution meant, blah, blah, blah..."" don't come crying to me. :)
 
 Ok, getting off my soapbox now, I'd say you're totally right. Certain branches of Christianity, like Catholisism, have traditionally been very resistant to change. Unwilling to adapt, one might say. And the Catholic church has been in a state of decline of late. The social climate in which Catholosism thrived no longer exists, and so it isn't doing as well. We also see lots of little churches springing up, filling religious enviromental niches, as it were. 
 
 What can we predict for the future? Here's my guess. The two main enviromental factors that will shape religion will be a desire for stability and an ability to adapt to new ideas. As communication and travel become easier, people will be exposed to more new ideas and cultures, and religions will be forced to deal with people saying ""Yeah, but what about this new idea I just heard? How does that fit in?"" On the other hand, as people get exposed to other ideas, they'll want to have some core of ideas of their own to hold on to. Sort of a psychological anchor. 
 
 I figure we should expect to see the more dogmatic churches fade away, as people become exposed to more, different ideas. If you can't adapt, you become extinct. Churches that espouse firm moral ideas based on humanisitic reasoning will probably do well.",2
"6856","And when one does?","He or she is still subject to attracting a mate more effectively than other monkeys, as a step toward producing offspring more effectively via any number of mechanisms.",2
"3988","for a creationist to concede to evolution would mean believing that genesis is false, which would mean that the bible is not true, which would mean that it cannot be the word of God, which would mean there is nothing to found a God-based religion upon.","And that is why they are referred to as creationists and not merely as christians. They are only a small subset of the huge christian population.",2
"3095","Why doesn't this apply to Soviet Russia - which had a population of similar size ? Presumably, your answer would be that the USSR was less ""developed"" than the US ?","You presume correctly, sir. :) Overall the USSR could produce almost the same level of technology the US could during the cold war; however the restrictive nature of Soviet society during that time I believe quashed the possibility of many bright Soviet citizens to be better educated, and eliminated the possibility that many of them could reach their potential. I hope the situation is improving there; guess we'll find out in 50 years.
 
 Another factor that contributed was the fact that there are more remote and undeveloped areas in the former USSR than in the US, which supports the idea that parts of the Soviet Union were (and may still be) less developed.",2
"95861","I can not agree with Stephen Grescott. I extremely doubt the fact that most scientists don't know what science is, we learned the definition of science in simple high school biology. Hopefully someone who has a degree in science knows what it is or the college is horrible. You can also not expect the definition given to be accepted as a neutral definition, when it's from such a biased source as answersingenesis.org.
 
 From dictionary.com:
 
 ""The observation, identification, description, experimental investigation, and theoretical explanation of phenomena.""
 
 This is the first definitioin, let me know if you disagree and you think one of the lower definitions is the correct one, but they don't seem to pertain to actual science in the classroom (packing a suitcase down to a science, etc.)
 
 Science is not ""a murky combination of facts and theories"" in the classroom, but the evidence is taught along with the theories. It is taught that theories are not fact but that they basically mean that the conclusion reached with the evidence we have right now is that theory, since no one has falsified it, and all predictions made have been correct.","The dictionary.com definition is vague, whether you use all 5 divisions of the definition, or only the first one that you quoted. I think that's what Grocott was saying - that it's not definable in a precise, non controversial way so that everyone can agree on exactly what it includes and what it does not. Even the word ""phenomena"" is vague. 
 
 The reason I said (and maintain) that it's a murky combination of facts and theories is because it can branch off in different ways and follow different paths, depending on the presuppositions (worldviews) of those assigned the duty of directing it. In this case it's the teaching establishment. There is only a finite amount of instruction time in schools. Some paths get more time, attention, and detail allotted to them than do other paths.",2
"18331","So, one set of creationists are XXXXXX, but the others are not?","Well done Monty. Mark that up as your first ever 100% honest and accurate post here.",2
"75962","Creationist make little quips about how evolution must be a racist theory et cetera but when I ask them to explain in more detail they just disappear. I find this quite annoying what should I do about it?","I know the feeling.
 
 Its very, very easy to make a statement associating two things (like racism and scientific evolution) its an altogether tricker one to then defend that statement against thorough scrutiny. 
 
 Or should I say they [YEC's] like to teach the contoversy?
 
 Just challenge their assertions, when they don't defend them and disappear it shows they are just taking the Michael.",2
"3153","science and biology has never been my forte, i'm more of a history and literature person. i believe evolution because it is accepted as fact within scientific circles and there is overwhelming evidence supporting it. you might criticize me for believing evolution happened simply because scientists say it did, but alas, thats the reason why. anyway...
 
 whenever i tell someone that i believe in evolution, they always tell me that if evolution were really true, there would be half-human, half-ape people walking around. i know that this is a ridiculous comeback and there is obviously a scientific explanation why there are not, so i was wondering if someone could let me know the reason why. next time i get told something like that, i want to be able to explain myself. thanks :)","I know very little about evolution, but I think that the half ape thing stems from the misconception that some people have that evolution means that humans are decended from apes, so our ancestor would be a half man/half ape. Instead, I believe that biologists think that apes and humans share a common ancestor, but our evolutionary paths diververged long ago. 
 Please anyone feel free to argue/correct me, since I said, I am by no means an expert on evolution.",2
"82211","Easily understood when man created his own god.","Indeed true. God created man in his own likeness and man returned the favor. Man created a vindictive, vengeful, and vicious god, according to the Bible. So where does a loving god come from?",2
"6019","It's not a difficult challange.","No, it wasn't. Given the number of scientists one might assume that at least one would confuse his science with his religion. It seems that according to AIG, 182 actually do. I really have to commend AIG in that they did not list ""Dr."" Kent Hovind, ""Dr."" Carl Baugh, ""Dr."" Don Patton. However, the AIG does list Thomas Barnes who's highest earned degree is an MS in physics, his Sc.D being honorary from his undergraduate, Christian university. Clifford Burdick has a ""degree"" from a non-university (as described in the mimeographed bulletin of the ""University of Physical Sciences"", from which Burdick claimed his degree: ""'The University is not an educational institution, but a society of individuals of common interest for the advancement of physical science. There are no campus, professors or tuition fee.""). Harold Slusher has an honorary degree from a Bible college with only a 1/2 man graduate science department in addition to his ""degree"" from Columbia Pacific University a non-accredited correspondence school that promises a degree in less than a year. I do note that Clifford Burdick is listed on list of deceased scientists who believed in a creator.
 
 I presume that the rest of the ""scientists"" listed by AIG actually have the PhDs that AIG claims of all 182 listed.
 
 I invite you to compare that list to the Steve list, now at 720+ scientists named Steve who accept evolution as the correct explanation for the observed diversity of life. The name ""Steve"" (and variations thereof) comprises about 1% of the population. The percentage of qualified scientists with that name cannot be far from the norm. The Steve list was initially composed of scientists with PhD degrees biology, geology, paleontology, or a related scientific field. However, there are also scientists in fields such as cosmology and astrophysics that are signatories as well as other fields with an interest in evolutionary theory. For example, Stephen Hawking has signed the Steve list.
 
 I invite you to find bogus and inappropriate degrees on the Steve list. I am sure that the NCSE would be appreciative of your efforts. Hopefully you will have a more difficult time than I did in identifying bogus degrees.
 
 Oh, yes. In my experience, creationist scientists were always creationist long before they were scientists. On the other hand, there are lots of scientists who were once creationists, before they became scientists. As many polls have shown, the more educated a person becomes, the less likely it is that he/she is a creationist.",2
"1127","How can you attempt to explain the appearance of something by the dissapearance of others?","Natural Selection (plus genetic variation).",2
"5634","Yet there was a case that I read about somewhere, where a sticker was placed in science textbooks advising children to study evolution ""with an open mind"", and an ACLU lawsuit ensued.","Indeed. Cobb County Georgia. And the sticker was found unconstitutional in Federal Court. The problem was that it was religiously motivated, was placed only in biology texts, didn't say anything true that the teachers weren't already teaching, and actually was not accurate. The sticker was found to be unconstitutional because it violated the second prong of the Lemon Test. I suspect that you don't know what that is. Anyway, the 11th Circuit reversed.",2
"86632","Lets assume for a moment that intelligent design is true, what can we then do with it?","Know it.",2
"6328","Here we go again.","Yep...
 
 emoticon_rolleyes",2
"5662","I actually think that ID has a pretty good chance of winning. One reason being is that ID links with the idea of God was taught to them even before they understood it, so it holds a deep impression on many people there. Another reason I think is that most of them probably never took a decent bio class, so they would have no idea what the evolutionsist was talking about. Lastly, people hold God in a lot higher posistion in their minds then evolution, already giving evolution a bad reputation, because its ""competing"" with God.","Sadly, you may be correct. The mindless majority of the American people have been duped to believe that science is somehow opposed to their religion. They know that the mythology of bronze age nomads is historically correct. Don't confuse them with facts - so what if grasshoppers don't have 4 legs, what if rabbits don't chew cud, and who cares it bats are not birds? The Bible is true without error.
 
 Certainly people who have bee indoctrinated to believe that ""GODDIDIT"" will believe that question. They have been taught that it is a sin to question revealed truth, and revealed truth is revealed by ""ministers"" who are scientifically illiterate.
 
 Why does creationism seem to be a matter of the views of those who are becoming rich from the stupidity of the Christins masses.
 
 In the mean time, the U.S. is now a second rate country, where our universities are manned by an increasing number of foreign professors. I don't have a problem with foreign professors except that there are no qualified U.S. citizens out there. It is becoming increasingly apparent that the leadership of U.S. universities is due to the influx of foreign professors. They get paid more here than in their own country, and of course, they are more qualified than U.S. applicants for their positions.
 
 I wonder if our universities will be able to maintain leadership in the world of academia when the entire upper echelon is overtaken by better educated and more qualified foreigners.
 
 In fact: Japan has about half the population of the U.S. and graduates about twice the number of students with degrees in science and engineering.
 
 Isn't it wonderful that we are debating the pseudoscience of creationism and ID in our school boards? It is the beginning of the end.",2
"73952","Intrigued, as always I went to dig a little deeper into the methods used. Generally speaking, one of the best dating methods for an amphibolite metamorphic rock would be to separate out amphiboles for Ar-Ar dating. Using the argon-argon variant of K-Ar allows many cross checks for excess argon or argon loss that are invisible to standard K-Ar dating. At the very least, a better approach would be to date the rocks using individual minerals. The worst possible method would be to measure the age on an inhomogeneous whole rock sample. In the footnotes, the methods are described as follows:
 
Whole rock' samples were analyzed in all cases-K-Ar at Activation Laboratories, Ancaster, Ontario, Canada; Rb-Sr, Sm-Nd and Pb-Pb at the PRISE Laboratory, Research School of Earth Sciences, Australian National University, Canberra, Australia.

 ....
 
 In short, this is a classic example of geochronology done poorly. Snelling either deliberately chose the worst rocks and the worst methods in order to guarantee strange results or was grossly incompetent. Well, ok maybe both. I also notice that the data are not given in the creation article. If someone has a more detailed description of the results, it'd be fun to look at the individual data points more carefully. Lastly, Snelling implicitly suggests that if geochronology is not correct every single time, then it can never be trusted. Wonder if he ever gets on a airplane.","He has a bit more basic information about R.A.T.E. on his webpage.
 
 TO also has a page critiquing R.A.T.E. methodology.
 
 Sorry, I know you're looking for more substantial personal feedback, but this is some good basic information that doesn't rely upon a billion links.
 You also might consider asking this question on iidb.org, and maybe Dr. Meert will respond to you personally.
 
 More importantly, let us not get hung up on analyzing the raw empirical data only. For example, if I use a stopwatch to time how long it takes for light to flood the room after I turn on the switch, and I come up with 0.06s, you can't argue with my empirical data: I timed it at 0.06s. The fact that human response time is comparatively lousy and that a stopwatch is awful for extremely short time intervals is more significant that the stopwatch reading itself. This is the primary error that R.A.T.E. makes.",2
"30982","It was the year 1909 and a navy officer (who was a Humanist) decided to search for the North Pole. He brought along a Biologist for research and a Priest just for moral support. While trekking through the middle of no-where they stumble across an igloo.
 
 The Priest exclaims:
 
 ""it's a miracle!""
 
 The Humanist dismisses it saying:
 
 ""don't be silly, man must have made it""
 
 Then the biologist pipes up:
 
 ""wait a minute""
 
 After jotting down notes and referring to his books for about an hour he says:
 
 ""yes, after scientifically analyzing the facts it's obvious to me that over a period of about 1000 years this snow shelter evolved""","The Biologist must have been thinking that a ""giant mushroom"" was the cause and evolve it. Now, that's very funny! :)",2
"71111","Whatever, people lying by saying that they lost their jobs because they said they believe in Intelligent Design? Good? Bad? Utterly predictable?
 
 http://www.expelledexposed.com/index.php/the-truth","I'll let you know to what extent the movie documents it. I'm off to see it in a few. :)",2
"44101","Faced with an increasingly vocal populace that is questioning evolution, museums across the United States have begun training their staff and volunteers to become better proponents of evolution while tripping up ""irrational"" supporters of the Bible's history of Earth.","Damn straight it's irrational.",2
"51501","In a proper debate the parties make belief statements with support. In the secound part you both ask examining questions of each others belief. In the thrid part you both address those questions. In the final part you conclude your debate with a closing statement. 
 Now on the count of three you guys go...one...two...three...","Sounds like a good plan to me...",2
"2182","* Homo Habblis:- Many scientists (evolutionary scientists included) are now recognising that Habblis is a waste bin of two or more creatures, and hence, is an invalid category.","Yes, there is some disagreement on how to classify the fossils designated as H. habilis. What of it? Yes, there is disagreement on whether the specimens themselves represent a direct ancestor or a closely related side branch. What of it? The point is that these fossils are clearly intermediate in characteristics between modern humans and ancient apes. They do fit very nicely on the family tree, either on the direct line to humans or very close to that line.",2
"3834","one other point, and i brought this up lots of times here and elsewhere, is that about ""christian/evolutionism hybrids"". that is, those that disregard the genesis story in the light of ""modern discoveries"", yet they believe that God exists and that salvation through jesus is attainable as the bible prescribes. while it is logically impossible to disregard genesis and at the same time accept the new testament, many people out there are comfortable with the idea. it totally eludes me though","I think the christians you describe do not disregard creation in Genesis per sae. They would agree absolutely with your 2 fundemental truths at the start of your post. However, they do not see it as a history as such, but more as an analogy to what happened. Some take it simply to say that God created the universe and put a soul in humans and find the detail of that (not the soul bit) in what we have discovered through science. Others would say it becomes ""historical"" at a certain point- Adam and Eve or maybe Noah. I don't think they are any less christian than those who choose to believe the story of creation literally, and it would surprise me to hear someone say that was the case.
 
 I think it does pose some awkward questions to hold such a view though, and while I don't see all your 8 examples in your later post as being the ones I have heard, they are certainly of that nature.
 
 Christianity has struggled with the logical conclusions of observation of the physical world for much time. Some of the examples from history are amusing today- the Omphilodian Heresy where the very discussion of whether Adam and Eve had navels was a heinous religous crime. The Heliocentricity debate where the Catholic Church eventually relented their scripture based denial of the earth orbiting the sun. And today the debate over the old earth and evolution.
 
 This seems to arrive from the fact that the religon is so encompassing in its assertion of truth. While this helps to create a powerful system of belief, it can put it in an awkward position when new discovery is made. The nature of peolpe seems to be the same conflicts have arisen again and again- with just the point of contention changing.",2
"7560","why do you make such a big issue of this? if you're in this forum, and you've seen this post, then creation vs evolution obviously strikes a nerve with you- why?! what is so fascinating about something you'll never live long enough to witness if it does exist and that you've seen all there is to see of if it doesn't exist?
 
 does anyone here really lack in something to validate themselves so much that they have to turn to a bunch of dead animals to find a reason for living?","Well, thank you for this thread Santafeur. I must say though that I peruse various threads just to read stuff. The C vs. E topic does not strike a nerve with me. 
 
 In fact, I also wonder what it is about the human mind that makes people so desperate to want to know how we came about. What difference does it make? We are here now. Could we possibly just accept that we got here somehow, and just move on?",2
"66501","How the most common definition of Intelligent Design in the news media is completely incorrect","It's quite obvious that it's the ID proponents who have issues with definitions, particularly among themselves. Behe has changed his own definition of IC, and Dembski changed Behe's definition of IC.",2
"6078","Fools! You've all been decieved! Listen not to the lies of the Foodstuff demons, instead bow down to the Invisible Flying Space Monkeys, for they are the only path into heaven!
 
 (wish I'd thought of the beer volcano. That's a good one.)","Just be like the Jews and Christians and steal the idea! A lot of their mythology isn't original: it was stolen from other people who thought it up first.",2
"96721","don't know since I don't believe in evolism or creationism.","so whats your belief of how life/the universe began lurch? (if any)",2
"30212","OK. That's probably correct. I did the calculations in cubic kilometers.","Well, then I'd have to convert everest to kilometers. I live in the US. Metric is alien. haahh.",2
"16901","I think the energy( essence of the human life) always was","So do I, but my reasoning is highly speculative, even by my own standards.",2
"8768","I shouldn't know, its never happened to me.","Me neither. I do know it's a funny thing to watch SS say such things despite having his own belief shot, bagged, tagged and buried",2
"72532","Maybe it's because the evidence that indicates a use for the appendix, rather than it being an incompletely useless vestige, is itself further evidence of evolution and common descent.","Bingo. Relationships between appendices of closely related species still suggest that the appendix used to have a different function, namely digestion of roughage. Linky. (Plus what Otto said, again.)",2
"51402","Today, no informed creationist would deny natural selection.","Good. But seeing how this was proposed over a century and a half ago by Darwin, what took the creationists so long to catch up?",2
