"","quote_text","response_text","relation"
"4973","And of course, after God had killed ""every thing that is in the earth,"" a dove managed to find a live olive leaf as a sign of receding floodwaters.","You know, that is one aspect of the story that no one ever seems to focus on when refuting the flood. I think it is an excellent extra point of refutation of the whole ridiculous story.",2
"1985","So please do not ask questions where you know that people most likely can't give you a definite answer (because no one knows it) just to finally say that if Evolutionists can't prove it completely it most likely isn't true... We all know that ourselves...
 
 There are no real answers to any of your questions... (yet)...","That was the whole point of asking the questions, to prove evolution isn't an absolute truth. emoticon_smile",2
"7701","Ironically, when I have publicaly advanced the idea that God is generally compatable with evolution, I find that my agnostic and atheistic colleagues are generally comfortable with such ideas, but many believers are dumbfounded.","I believe that's true, and as a ""believer"" (creationist), here is what is hard to understand about that; In Matthew, 12:30, Jesus says ""He who is not with me is against me, and he who does not gather with me scatters"". It is safe to say that both creationists and theistic evolutionists would accept that statement from Jesus, and would seek to be ""with"" him, while agnostic and atheists would consider themselves ""not with"" him. Yet theistic evolutionists are comfortable to (usually politically) be ""with"" agnostics and atheists, and separate themselves from creationists. If they're genuine Christians, knowing about the warnings in the Bible about false teachings, how can they be comfortable with that?
 
 Miller laments in several places throughout the book that atheists use evolution as a weapon against religion, and that it shouldn't be that way - that it causes more strife between the two than should exist.",2
"23572","...is that they think that ...they aren't loved...","Might be something to be said for that. Are there any studies that show possible causes of suicide?",2
"94732","I admire your zeal. I agree God is real.
 
 However, you need to work this into a statement pertinent to the ""Creation v Evolution"" theme of this subject. What exactly do you want people to debate you about, with regards to the topic?","ya i am trying to work on that stuff. ummm my debate is to get ppl to read it and argue what i have so i can help them",2
"26782","Give to God what belongs to God. Give to science what belongs to science","I see the similarity with the original scripture, in which Jesus was recognizing the authority of both God and Caesar in the world. However, Jesus was talking about the political power in the world. Jesus called the academics of his day, vipers and hypocrits, because they pretended to be holy but were evil. He called the wisest of men fools, because they did not believe in God. 
 
 Also, as I stated before, truth should be the ultimate goal. I do not fear science. I do not see any truth that science may happen to reveal as a threat to faith. Why? Because God is Truth. Jesus said, ""And the truth shall set you free""!!!",2
"25891","I'd love to know the exact questions asked.:)
 
 -Wez","Agreed.... there is nothing over at MORI about it. Perhaps Horizon will elaborate tonight.",2
"7591","Originally posted by Debater 
 A. afarensis was an ape","So am I, so are you.",2
"3098","It was the year 1909 and a navy officer (who was a Humanist) decided to search for the North Pole. He brought along a Biologist for research and a Priest just for moral support. While trekking through the middle of no-where they stumble across an igloo.
 
 The Priest exclaims:
 
 ""it's a miracle!""
 
 The Humanist dismisses it saying:
 
 ""don't be silly, man must have made it""
 
 Then the biologist pipes up:
 
 ""wait a minute""
 
 After jotting down notes and referring to his books for about an hour he says:
 
 ""yes, after scientifically analyzing the facts it's obvious to me that over a period of about 1000 years this snow shelter evolved""","The Biologist must have been thinking that a ""giant mushroom"" was the cause and evolve it. Now, that's very funny! :)",2
"2677","Thanks, that's very kind of you.","lol
 you're welcome emoticon_xangel",2
"1231","What sicknesses will we cure with it?","Can't say.",2
"94162","Utter nonsense!","Yea verily!",2
"67461","Intellegent Design is the study of the idea that certain biological phenomena are too complex to have been evolved from a series of simpler organisms, and therefore must have been created fully functional from the onset. It is based on the idea that if we can observe an organism or an organic function whose existence cannot be explained by the successive adaptation of the evolutionary model, then that organism or function is evidence for intelligent design. 
 
 When intelligent design first emerged, among the long list of examples of irreducibly complex phenomena were the eye, the flagellum and blood clotting. All of these have been shown to have simpler counterparts which also fucntion, and therefore which could have been the evolutionary basis for the emergence of these more complex functions. These examples are summarized in wikipedia's article Irreducible complexity - Wikipedia, the free encyclopedia","Yes I know, a lot of people have done a lot of work to try to refute Behe's work. From your link;",2
"1295","for the sake of this topic, would it be ok if we borrow the word evolution from your biologist for a minute?","Well, I can't stop you. But if some creationist says ""But in that other thread you said evolution meant, blah, blah, blah..."" don't come crying to me. :)
 
 Ok, getting off my soapbox now, I'd say you're totally right. Certain branches of Christianity, like Catholisism, have traditionally been very resistant to change. Unwilling to adapt, one might say. And the Catholic church has been in a state of decline of late. The social climate in which Catholosism thrived no longer exists, and so it isn't doing as well. We also see lots of little churches springing up, filling religious enviromental niches, as it were. 
 
 What can we predict for the future? Here's my guess. The two main enviromental factors that will shape religion will be a desire for stability and an ability to adapt to new ideas. As communication and travel become easier, people will be exposed to more new ideas and cultures, and religions will be forced to deal with people saying ""Yeah, but what about this new idea I just heard? How does that fit in?"" On the other hand, as people get exposed to other ideas, they'll want to have some core of ideas of their own to hold on to. Sort of a psychological anchor. 
 
 I figure we should expect to see the more dogmatic churches fade away, as people become exposed to more, different ideas. If you can't adapt, you become extinct. Churches that espouse firm moral ideas based on humanisitic reasoning will probably do well.",2
"2631","For those who believe the world is millions upon millions of years old, you can see that 100 years for a color change in a species is quite fast.","And changing in about 50 years twice in the space of 150 years is even faster.",2
"9031","There are lots of facts that support it . The anthropic principle , the sudden appearance of fossils with no evolutionary past , symbiotic relationships between plants and insects. The fact that dogs have dogs and cats have cats. You interpretation of the evidence is just that your interpretation.","Besides, evolution has relatively few holes. A fair percent of it has actually been proven in the natural and artifical worlds.",2
"79901","As of today, 11-08-04, the Cobb County (GA) school system is being tested in court about the validity of their warning sticker pasted in every Evolution textbook. The sticker basically says that evolution is a theory and should be approached with an open mind.
 
 The evolutionists are saying this is an endorsement of creationism, therefore is a religious doctrine being taught in school...against the law.
 
 This is the same school system whose leader recently tried to have the word ""evolution"" deleted from the school curriculum.
 
 Is the Bible Belt getting too tight?","Yes, it is. I'm actually considering moving out of the south specifically for that reason. I will miss the largemouth bass fishing....wth is a pike? ;) It's always been that bad though, now that I think about it. It's just I ignored it more when I was younger.
 
 The sticker is moronic IMO. If they label ""evolution"" with that, they should go ahead and label every single book, TV, everyone's forehead, and every object that can hold a sticker in the entire world. Some people thing there is ""openess"" about being correct or incorrect. On some things that are opinion, sure. On reality? Not the case.
 
 I mean, I'm not running around believing John Kerry actually won the election despite the evidence, although I certainly could, if I approached the election results with ""an open mind"". Although I could....hmmm...just have to keep it up for 4 years!
 
 -Mach",2
"465","Finally..we have the biggest error of all. I've bolded the part that destroys everything.","Including the universe?",2
"39151","One item that shoud be mentioned is that this expidition set out in this area specifically to find the transitional form between land and water creatures.
 
 They went looking in this area because that had the right geology, with the rocks the right age. They found what they had predicted they would find.. and what they specificlaly were looking for.","I think that is the most interesting part. This wasn't just a lucky find. This demonstrate the power of theory, that it is predictive. Based on a prior theoretically understanding, they hypothesized that the creature would be where it was. As the hypothesis proved correct, this further adds to the validity of the original theory.",2
"500","Is there really a difference between this and the theory of spontaneus generation?","Yes. Only the ignorant think not.",2
"25482","I don't know, could it be because they're XXXXXX? Or maybe it's because atheists are deluded. emoticon_xbye","they don't want to except that there is something/someone more powerful than them:xbanghead",2
"5256","Teach the kids what is conjecture and what is not.","We do. We don't even teach the conjecture. And we don't teach superstition. That's why creationism isn't taught.",2
"11532","A species of Darwin's finch in the Galapagos has evolved a smaller beak to avoid competing with a larger-billed recent immigrant","You know what they mean, I know what they mean, but as someone involved in teaching evolution to high school kids I wish they'd avoid the implication of purposeful change and just refer to beak size changing in response to new selective pressure.
 
 As I said, I may just be being nit-picky. Language apart, this is another nice example of evolutionary change happening right before our eyes.",2
"88251","Actually, Dembski is known for his useless maths.","Really; Dembski? Have you any good sites? Are they 'published' anywhere :) (hint hint)",2
"95862","I can not agree with Stephen Grescott. I extremely doubt the fact that most scientists don't know what science is, we learned the definition of science in simple high school biology. Hopefully someone who has a degree in science knows what it is or the college is horrible. You can also not expect the definition given to be accepted as a neutral definition, when it's from such a biased source as answersingenesis.org.
 
 From dictionary.com:
 
 ""The observation, identification, description, experimental investigation, and theoretical explanation of phenomena.""
 
 This is the first definitioin, let me know if you disagree and you think one of the lower definitions is the correct one, but they don't seem to pertain to actual science in the classroom (packing a suitcase down to a science, etc.)
 
 Science is not ""a murky combination of facts and theories"" in the classroom, but the evidence is taught along with the theories. It is taught that theories are not fact but that they basically mean that the conclusion reached with the evidence we have right now is that theory, since no one has falsified it, and all predictions made have been correct.","The dictionary.com definition is vague, whether you use all 5 divisions of the definition, or only the first one that you quoted. I think that's what Grocott was saying - that it's not definable in a precise, non controversial way so that everyone can agree on exactly what it includes and what it does not. Even the word ""phenomena"" is vague. 
 
 The reason I said (and maintain) that it's a murky combination of facts and theories is because it can branch off in different ways and follow different paths, depending on the presuppositions (worldviews) of those assigned the duty of directing it. In this case it's the teaching establishment. There is only a finite amount of instruction time in schools. Some paths get more time, attention, and detail allotted to them than do other paths.",2
"2250","I'd congratulate you on your win DamEtel, but I'm more impressed with your patience.","Well, I personally agree that I 'spanked' marc9000 (http://www.4forums.com/political/showthread.php?t=6348). But we'll have to leave it to the judges to make the formal decision.",2
"71511","Let me propose the shoe fetish as an evolutionary adaptation. We'll define a shoe fetish as follows: a person, usually male, can only become sexually aroused when shoes are involved in the sexual act. Mind you, I'm not an expert on the shoe fetish, so my definition may be inaccurate. But that need not stop me from doing a little evolutionary psychology here.","Exactly.
 It seems that anyone can dream up hypotheses in evolutionary psychology.
 
 Here's what Coyne said:",2
"26771","Thanks, that's very kind of you.","lol
 you're welcome emoticon_xangel",2
"77441","How do you explain the change of appearance of the animals over time, as recorded by fossils?","Exactly and if you accept that animals have been on the Earth for millions of years then why can't evolution be a process that God created and controls?",2
"35822","So you're posting in an effort to bait specific people? You can try putting their name in the subject, addressing them specifically, or emailing them. 
 
 It may also help if you declare it rather than ask a question. If you ask a question and get an answer, then remark ""duh"", it doesn't ... cast a good light on the writer. 
 
 -Mach","Well said.",2
"20822","What happens, is that if you show a new body part evolving, such as the cecal valve in certain lizards, they just push the goal posts back a bit:
 
 ""No, I meant a new body part that is so complex that it couldn't possibly evolve quickly enough for someone to observe it happening. And no one has ever observed that to happen, so evolution is false.""
 
 Oh. emoticon_wow","Walking-fish:
 It's a simple game. Just demand that ""evolutionists"" show them an example of a macroevolutionary event within a microevolutionary time frame. And if such a feat were ever accomplished it would serve as an example of special creation rather than evolution anyway.",2
"90721","Yes, it's a common problem that nutjob parody posts can be hard to distinguish from sincere nutjobs posts. This is an artifact of how utterly ridiculous the nutjob position is.","Agreed. Lesson learned, dont make a joke post in a Creationism Vs. Evolution discussion.",2
"1208","I read an article yesterday (about Evolution, Extinction, and Economics) in which it was claimed that 99% of all species that have ever existed are now extinct.
 
 This sort of claim (which I've come across before) troubles me: how can it be asserted, with any certainty at all:
 
 1). The number of species which have evolved.
 
 2). The percentage of that number that have become extinct.
 
 
 ????","I believe it is merely all known living species against those known by the fossil record and extinct. There are undoubtedly more extinct species that we are unaware of than living ones.",2
"5869","But evolutionists are just as religious as Christians: they have their own unseen miracles - (random mutations)....their own clergy (scientists)...their own Bible (The Origin of Species)....and their own god (Natural Selection).","Well said. 
 
 With this religion, the gap is very wide between the ""average guy"" and ""authority"", because their clergy is more involved in politics than the clergy of Christianity, or the Creator himself. It fits with more Democrats being evolutionists, and more Democrats favoring bigger domestic government.",2
"77442","How do you explain the change of appearance of the animals over time, as recorded by fossils?","Exactly and if you accept that animals have been on the Earth for millions of years then why can't evolution be a process that God created and controls?",2
"5135","The discovery of a fossilised rabbit in the Burgess Shale may demolish one of the pillars of modern science, the theory of evolution. The late J. B. S. Haldane famously said that all it would take to falsify evolution is a single Cambrian rabbit fossil, and that is exactly what has been uncovered by paleontologist Dr Wilfred Splenebyrst of the London School of Ergonomics.","Those nasty deceptive Darwinians have been overthrown at last.",2
"35032","Sometimes the state of the education system in the USA makes me cry.","Sometimes?
 
 The state of the public education system in the US is downright criminally neglectful.",2
"92292","As was already pointed out. Sheesh, I've got furniture that's smarter than this.","Well at least more coherent if the joints are tight and the glue is any good at all!",2
"3637","""Six pairs of these aortic arches loop over the pharynx. In primitive fish, these arches persist and enable the gills to oxygenate the blood. In adult birds and mammals, in which lungs oxygenate the blood, such a system makes little sense - but all six pairs of aortic arches are formed in mammalian and avian embryos before the system eventually becomes simplified into a single aortic arch. Thus, even though our physiology does not require such a structure, our embryonic condition reflects our evolutionary history."" (Developmental Biology: Seventh Edition, Scott F. Gilbert, Sinauer Associates Inc., 2003, p500)","Another characteristic in this same general area that ties us back to fish is the development of our parathyroid glands - which are very similar to gill buds in fish - from a particular pharyngeal arch: the same one that in fish gives rise to the gill buds!
 
 Moving on to the kidneys for a minute. The human embryo forms not one, but 3 successive kidneys: the pronephric, mesonephric, and metanephric kidneys. Only that last one persists and only it is the kidney you and I and all of our fellow humans use. Why do human embryos go through two transient and simpler kidneys before getting it right? Here's a hint: the other two are carry overs from simpler organisms! The evolutionarily simplest vertebrates, such as hagfish and teleost fish, develop only the pronephric kidney: it is their adult functional kidney. Now move up an evolutionary notch to (other) fish and amphibians. In their embryos, the first kidney still develops, but soon begins to degenerate and is replaced by the mesonephric kidney, which is the functional adult kidney in these organisms. Now move up another evolutionary notch, to reptiles, birds, and mammals. Their embryos form the first kidney, which then degenerates and is replaced by the second kidney, which then degenerates and is replaced by the final, metanephric kidney: their adult functional kidney.
 
 The above is not anywhere near a complete list of embryological evidences for common descent/evolution.
 
 PS: Note the serial addition of developmental stages that occurs in kidneys as one moves up to higher evolutionary levels: ""ontogeny recapitulates phylogeny"". Of course this ""law"" does not hold for all organs/organ systems in all organisms, but it does hold for a few cases. And that's enough to clearly indicate evolution of those organ systems by their being retained from ancestors and then modified during embryonic development.",2
"60191","It's not a difficult challange.","No, it wasn't. Given the number of scientists one might assume that at least one would confuse his science with his religion. It seems that according to AIG, 182 actually do. I really have to commend AIG in that they did not list ""Dr."" Kent Hovind, ""Dr."" Carl Baugh, ""Dr."" Don Patton. However, the AIG does list Thomas Barnes who's highest earned degree is an MS in physics, his Sc.D being honorary from his undergraduate, Christian university. Clifford Burdick has a ""degree"" from a non-university (as described in the mimeographed bulletin of the ""University of Physical Sciences"", from which Burdick claimed his degree: ""'The University is not an educational institution, but a society of individuals of common interest for the advancement of physical science. There are no campus, professors or tuition fee.""). Harold Slusher has an honorary degree from a Bible college with only a 1/2 man graduate science department in addition to his ""degree"" from Columbia Pacific University a non-accredited correspondence school that promises a degree in less than a year. I do note that Clifford Burdick is listed on list of deceased scientists who believed in a creator.
 
 I presume that the rest of the ""scientists"" listed by AIG actually have the PhDs that AIG claims of all 182 listed.
 
 I invite you to compare that list to the Steve list, now at 720+ scientists named Steve who accept evolution as the correct explanation for the observed diversity of life. The name ""Steve"" (and variations thereof) comprises about 1% of the population. The percentage of qualified scientists with that name cannot be far from the norm. The Steve list was initially composed of scientists with PhD degrees biology, geology, paleontology, or a related scientific field. However, there are also scientists in fields such as cosmology and astrophysics that are signatories as well as other fields with an interest in evolutionary theory. For example, Stephen Hawking has signed the Steve list.
 
 I invite you to find bogus and inappropriate degrees on the Steve list. I am sure that the NCSE would be appreciative of your efforts. Hopefully you will have a more difficult time than I did in identifying bogus degrees.
 
 Oh, yes. In my experience, creationist scientists were always creationist long before they were scientists. On the other hand, there are lots of scientists who were once creationists, before they became scientists. As many polls have shown, the more educated a person becomes, the less likely it is that he/she is a creationist.",2
"498","If a material is radioactive, it only occurs naturally if the half life is at least 2 billion years.","And that is why there is no plutonium found in the natural (fossil) fission reactors discovered in Oklo, Gabon in Africa.
 
 A fission reaction in the presence of U-238 always produces plutonium. In fact, about 1/3 of the energy output from a typical reactor in the U.S. comes from the fission of plutonium-239 that is created by the fission of U-235. When there is not enough fissionable material left in the fuel to sustain a reaction, there always remains several isotopes of plutonium that were not present in the original enriched uranium fuel.",2
"71682","Why did my post get deleted? Did you guys realize I was right so you decided to delete it when we exposed the religion of evolution?
 
 Anyway, supersport, good job, keep up the good work. I liked that last link you posted it was really interesting, but someone deleted it - they must have realized the truth it exposed.
 
 I think it's funny how the evolution beleivers can call you a liar and all sorts of other stuff, but when we point out how unfair it is, the evolution mod goes and deletes our posts. Total bias.
 
 The mod should at least send you a message to tell you why the post was deleted, if it happens again without warning I'm going to contact the admin about the bias: I've kept a record of my posts here because this has happened before on other boards with large evolution support.","Yea an explanation would be nice.....I don't know that I've had anything deleted on here before -- (it could have happened without me knowing it) -- but I have no idea why that was deleted. If there was something specific I said, the post should have been snipped, not deleted altogether.",2
"55281","However, not all members of the population are able to breed.","And reproduction rates are not uniform among a population.
 Don't let him bait you into following his unstated assumptions.
 
 However, I must say that those are fine examples of competition within populations. Good work. Same with ""artificial"" (or at least, not exactly natural) selection.",2
