"","quote_text","response_text","relation"
"5645","I am intrigued to see that both sides have to be black or white. Either the creationist says the Bible is true down to the last detail or the anti-creationists say it is totally false and absolutely nothing as described ever happened.
 
 I wish to wave the flag for the middle ground. I do not believe that the Bible is 100% accurate historically. I do believe that many events (including the flood) happened in some form or other and many of these are long-ago racial memories which may well have been enhanced/distorted/spun over the course of millenia.
 
 Trying to date the early parts of the Bible is effectively impossible. It is hard enough later on even at the time of the 'slavery' in Egypt.
 
 Much more interesting to try and workout what may have happened.","I think that this is my view of it all as well. A lot of the events of the bible (mainly the old testament) are things that might have occured in one form or another, and much of the events of the New Testament DID occur.
 
 An example of my view is that I think that the flood did happen. It all started as a very large flood (probably in a river valley) that was much larger than normal (say a ""500-year-flood"" or a larger discharge event), possibly destroying a bunch of dwellings and maybe killing a lot of people, but some surviving leading to the Noah character. Eventually over the millenia, it got distorted and blown well out of proportion until it became a flood that covered the entire world. Then it led to the Epic of Gilgmesh, which was then adopted by those writing the early books of the Bible under the form it is seen as today.",2
"35261","Science will never be able to disprove any god because of some flaw science happens to point out. The best individuals can do is, when people try to reason that such perfect organs imply a designer, point out that the design isn't all that perfect after all.","Exactly. Trying to prove that God, if he exists, didn't make us as good as an all powerful being should have made us doesn't prove anything in the God debate. I could always debate that since God is all powerful and all knowing he could have always thought of something better to do. If he made those changes, then of course there would still be something better he could have thought of. This would be an endless loop of creating something better and better until finally he would have to stop and say that is good enough. But even then this debate that he didn't make us as good as he could have would be valid in my view.",2
"93111","Well, then. They're not TROO christians. Just ask a certain poster on this board. When I told this certain poster that I have known several clergymen from several Christian denominations who accepted evolutionary theory, that's what he told me.
 
 That certain poster and others would rather claim Newton, who was an arian, as a christian rather than clergymen who accept the divinity of Christ. Those clergy just understand both science and religion better.","Too be sure. However, there seems to be a lot of CLERGY that are not 'true christiasns'. 
 
 Or, could it be, that the person making that claim is not a 'true chrisitan', but is in denial?",2
"22241","If God is all-powerful, then His words should be all that's needed. To me, the world is proof that God is all-powerful. The beauty and complexity is just staggering. (if all the DNA in the human body was stretched out it would circle the moon 6,000 times!)
 
 http://www.ba-education.demon.co.uk/for/science/dna.html","So much about complexity on earth has been discovered since Darwin, yet comparatively little more complexity has been discovered in all the dead rock planets all around us. But Darwinism will always be the faithful beginning point for atheism, just as the Bible is for us.",2
"49731","And of course, after God had killed ""every thing that is in the earth,"" a dove managed to find a live olive leaf as a sign of receding floodwaters.","You know, that is one aspect of the story that no one ever seems to focus on when refuting the flood. I think it is an excellent extra point of refutation of the whole ridiculous story.",2
"60181","Ill consult some of my friends to help me on these issues if you dont mind.","Sounds good.",2
"6018","Ill consult some of my friends to help me on these issues if you dont mind.","Sounds good.",2
"8594","And primarily American evangelical protestants at that, but that's a mouthful.
 What I'm asking really is that given they're promoting Jewish scripture, why are they ignoring Jewish interpretation? It just seems bizare.","Well, you will find claims amoung this group that 'If Jews understood their own scriptures, they would accept Jesus as their Lord and Savior', and ""Christians are fullfilled Jews"".",2
"69432","So why do we have reproduction? It is necessary for evolution to occur.","It would be more accurate to say that evolution has selected for reproduction and death over immortality and self-repair - if the latter is even possible.",2
"89702","OccamsRazor: How would you answer the arguement put forth by Red Queen theory- that sexual life has to continually reproduce just to keep pace with other life hostile to it? If one organism were to stop reproducing and exist in status quo it will sooner or later fall victim to the ever evolving parasites that target it or organisms competing for its ecological niche. As it has stopped running the evolutionary arms race it is forever stuck with the characteristics it was born which would rapidly reach obsolescence (on the scale of reproductive generations).","Probably like I already did in my thread-starting post :-)",2
"48872","I got a question: are Polymerases protiens?","Yes.
 
 (and this is to add stuff to make the post stick....)",2
"74601","Isa 27:1 In that day the LORD with his sore and great and strong sword shall punish leviathan the piercing serpent, even leviathan that crooked serpent; and he shall slay the dragon that [is] in the sea.","As above",2
"76611","or bs.","Yes.",2
"78061","Actually, the Mormon seminaries aren't ""on the grounds,"" although they may be on an adjacent, privately owned piece of property. It would be unconstitutional for the seminaries to be on property owned by the school district. The children go to the seminary on released-time, which has been found to be constitutional (although I don't see how).
 
 Pertinent decisions about religious instruction and schools are:
 
 McCollum v. Board of Education (333 U.S. 203)
 Zorach v. Clauson (343 U.S. 306)
 
 McCollum found that religious instruction on school property is unconstitutional, while Zorach found that ""accommodating"" religious instruction by releasing students from school for that purpose was not.","Yep thats true.
 
 There in separate buildings but right next to each other.
 
 I see it being about as attractive as a crack house next to a school with a revolving door in front.",2
"1079","3. What is the proposed progression in macroevolution? Is it something like unicellular life to multi-cellular life, random multi-cellular conglomerations to an amoeba, to a fish, to a dinosaur, to a mammal, to an ape, and finally to a man??","Far too simplistic to be called accurate, there is some truth in this.",2
"2349","While Wong [9] highlighted the precursor-product relationships between amino acids and their crucial role in defining the organisation of the genetic code, Miseta [10] clearly identified that the non-amino acid molecules that were precursors of amino acids might have been able to play an important role in organising the genetic code. Miseta [10] suggested the idea of an intimate relationship between molecules, the intermediates of glucose degradation, as precursors of precursor amino acids, and the organisation of the genetic code. This observation is also analysed by Taylor and Coates [11] who showed the relationship between the glycolytic pathway, the citric acid cycle, the biosyntheses of amino acids and the genetic code (Fig. 1) and, in particular, they point out that (i) all the amino acids that are members of a biosynthetic family tend to have codons with the same first base (Fig. 1) and (ii) that the five amino acids codified by GNN codons are found in four biosynthetic pathways close to or at the beginning of the pathway head (Fig. 1)[11]. More recently, Davis [12,13] has provided evidence that tRNAs descending from a common ancestor were adaptors of amino acids synthesised by a common precursor and he also discusses the biosynthetic families of amino acids, suggesting their importance in genetic code origin.","Is it correct to assume that in the presence of the precursors of the standard genetic code (e.g. intermediates of glucose degradation and the citric acid cycle), the intimate relationship between these molecules resulted in the inevitable organization of the genetic code (global optimum of the system)?
 
 Articles 5-7
 These articles discuss fascinating mathematical representation of the genetic code. For example, in article 6 a representation of the genetic code as a six-dimensional Boolean hypercube is proposed. 
 Abstract:",2
"5823","Surely the theory of evolution cannot predict whether a species is extinct or not!","You are correct. That fossil species have gone extinct is an observation.",2
"810","Look, I'm a Christian, and us Christians, we understand that things like miracles that defy the laws of physics are the truth. We will never question that, because we are 100% certain that God meant what he wrote. Scientists aren't certain about anything - all they have is a bunch of theories! (gravity) Clearly, stuff like science and reason have no place in our lives in the 21st century - we must live by the words of a very, very, old religious book. So that when the earth is consumed in fire at Armageddon, we'll physically ascend to paradise. And when I pray, the creator himself, and his son, born of a blessed virgin, come, and they speak to me, and they tell me I'm correct. So atheists, who exactly is the deluded one here?","It's always interesting to see atheists making profound statements about billions of years, and mocking the Bible as being ""very, very old"". emoticon_confused Okay, enough about that - I'm now going to condense the various atheist explanations that have been presented to me at 4forums over the years. Is the following a parody, or is it the real thing?",2
"4321","Carbon's half life is too short. Bottom line - it does not go back far enough.","Yes. That's it.",2
"94931","The strata is another real problem for evolution,","And we will get to that, but I'd really like to keep this discussion on track.
 
 That'll have to do for now, it's 2:30am and I have work tomorrow.",2
"5260","Of course they do. Just look at Black Phoenix. You would probably be suprised how many people believe just like he does. I live in the Bible belt, so the majority of people I know are creationists.","I've lived in the Bible Belt (little rock, ark.) and maybe I still do (nashville), and the majority of average middle class people there were quite southern baptist and pentacostal (in nashville it's Church of christ or assemblies of god, whatever that is). But, I'm not so sure how they stand on creationism. I'll bet a lot of them just go ahead and believe something close to genesis (not literal), but surely they don't totally discount evolution (at least the people I have met and have known). But, if you asked them if it takes faith to believe evolution, they will all say ""Yes, it's just a shaky unproven theory that requires faith to accept."" And that makes them feel better about believing the absurd.",2
"7017","It is an animal, with a few parts from column A, a few from column B.","And therefore a transitional by definition.",2
"38341","one other point, and i brought this up lots of times here and elsewhere, is that about ""christian/evolutionism hybrids"". that is, those that disregard the genesis story in the light of ""modern discoveries"", yet they believe that God exists and that salvation through jesus is attainable as the bible prescribes. while it is logically impossible to disregard genesis and at the same time accept the new testament, many people out there are comfortable with the idea. it totally eludes me though","I think the christians you describe do not disregard creation in Genesis per sae. They would agree absolutely with your 2 fundemental truths at the start of your post. However, they do not see it as a history as such, but more as an analogy to what happened. Some take it simply to say that God created the universe and put a soul in humans and find the detail of that (not the soul bit) in what we have discovered through science. Others would say it becomes ""historical"" at a certain point- Adam and Eve or maybe Noah. I don't think they are any less christian than those who choose to believe the story of creation literally, and it would surprise me to hear someone say that was the case.
 
 I think it does pose some awkward questions to hold such a view though, and while I don't see all your 8 examples in your later post as being the ones I have heard, they are certainly of that nature.
 
 Christianity has struggled with the logical conclusions of observation of the physical world for much time. Some of the examples from history are amusing today- the Omphilodian Heresy where the very discussion of whether Adam and Eve had navels was a heinous religous crime. The Heliocentricity debate where the Catholic Church eventually relented their scripture based denial of the earth orbiting the sun. And today the debate over the old earth and evolution.
 
 This seems to arrive from the fact that the religon is so encompassing in its assertion of truth. While this helps to create a powerful system of belief, it can put it in an awkward position when new discovery is made. The nature of peolpe seems to be the same conflicts have arisen again and again- with just the point of contention changing.",2
"11081","Got any objective sources?","Yes. www.talkorgins.org",2
"649","That's an interesting subject, I had not heard of that b4. Did our bodies once produce Vitamin C?.","Yep. But our ancestors lived in an area of abundant fruit, and we got all we needed from our diets, so it was no big thing when the gene broke. A few non-primate organisms also have it broken, but it's broken in a different way.
 
 Barbarian observes:
 It's remarkable then, how much progress we've made. You may or may not approve of the theory, but it works very well at learning more about biology.",2
"7268","....notice how they, as well, are calling for carbon 14 dating on them:","But of course. Why wouldn't creationists call for carbon 14 dating on inappropriate samples? But there is actually no need to do so since the fossils have been reliably dated to around 68 million years by other means.
 
 By the way, I said that Dr. Schweitzer hadn't been mistreated, but I was wrong. Here is an article that talks about it.",2
"43121","Thanks for the resouce link. The issues involved will likely occupy us for a long time to come. Especially the current wars raging over the infamous Hobbit! The migrations of our species and our cousins is however slowly becoming more highly resolved and its an interesting (if complex and incomplete) tale so far. Lots more to come one suspects.","Yes, I believe there will be a lot more to come (as you said, just look at the ""hobbits"" that were recently discovered). I love this sort of look into the migrations of everyone over the last 160,000 years or so.",2
"67062","Evolution is supposed to be science, and is said to not address religion.","And the scientific papers don't. The problem here is that creationists don't read the scientific papers. In fact, most can't even understand them.",2
"2589","I'd love to know the exact questions asked.:)
 
 -Wez","Agreed.... there is nothing over at MORI about it. Perhaps Horizon will elaborate tonight.",2
"94932","The strata is another real problem for evolution,","And we will get to that, but I'd really like to keep this discussion on track.
 
 That'll have to do for now, it's 2:30am and I have work tomorrow.",2
"11791","Like talking to Richard?","And Monty, perhaps they are twins?",2
"4312","Thanks for the resouce link. The issues involved will likely occupy us for a long time to come. Especially the current wars raging over the infamous Hobbit! The migrations of our species and our cousins is however slowly becoming more highly resolved and its an interesting (if complex and incomplete) tale so far. Lots more to come one suspects.","Yes, I believe there will be a lot more to come (as you said, just look at the ""hobbits"" that were recently discovered). I love this sort of look into the migrations of everyone over the last 160,000 years or so.",2
"54091","Scott,
 
 You missed Monty's point. Catholics ARE Christians. I've heard that there are more than 1000 different sects that claim to be Christian, including Orthodox Christians and various and sundry Protestant sects. It would have been more correct for you to state that basically everyone you know is Christian.","This is correct. It is almost insulting to regard people as either a) Christian OR Catholic - as this also implies that Orthodox are neither",2
"3590","Women haven't cornered the market on crying, there are a lot of men cryers out there too.","I think it is simply been more socially acceptable for women to cry openly.",2
"42301","That happens, too. For example, our gene for vitamin C is broken and no longer works. .","That's an interesting subject, I had not heard of that b4. Did our bodies once produce Vitamin C?.",2
"47771","The comeback is that science just hasn't found the proof yet.","Well, yeah, if science hasn't provided an explanation for a phenomenon, then all we can do is shrug and submit grant proposals.",2
"23571","...is that they think that ...they aren't loved...","Might be something to be said for that. Are there any studies that show possible causes of suicide?",2
"45442","Come on, it's Andy Schlafly. What do you expect from the spawn of Phyllis?","Oh, that explains a lot. 
 
 I actually forgot who she was, had to google the name. As soon as I found her writings, I remembered *shudder*. Read some of her stuff a few years back. Scary",2
"19901","http://news.bbc.co.uk/1/hi/sci/tech/4648598.stm
 
 It's not just the Americans that confuse religion with science, it would appear.","Yes, I've met enough ""British"" creationists to know. The difference is one of exposure (they don't have anything like the public profile of the US movements) and the pervasive attitude to religion in the UK- people are generally much less up front about their religious beliefs over here.
 
 On the poll results, there is some ambiguity IMO. When it states 22% of people believed in creationism what exactly was the question posed? does that mean young earth creationism or old earth creationism or both? Also interesting is the apparent indication of how intelligent design has been rapidly adopted as a method of explaining ones position.
 
 The program, Horizon: A War on Science is on tonight at 9:00pm on BBC2, should be an interesting watch.",2
"24772","How can we test it?","By creating an experiment in which we observe it taking place.",2
"25892","I'd love to know the exact questions asked.:)
 
 -Wez","Agreed.... there is nothing over at MORI about it. Perhaps Horizon will elaborate tonight.",2
"6809","See, here you've seperated mind, spirit, soul. The bible didn't do this, unless Zechariah is being misinterpreted. It basically said, in your interpretation, that the spirit and the soul are the same thing.","Yes, it is very hard, even for theologians, to explain.",2
"75091","That reminds me of the discussion I got into on a ""christian"" board when I referred to a particular pompous XXX as a pompous XXX. I was banned for a week for using profane language. Pointing out that an XXX is an animal and that my remark made sense only in that light was fruitless. My answer was to demand that they ban some versions of the Bible because they told of how Abraham tied his XXX to a tree and Jesus sat on his XXX in Jerusalem. Didn't phase them. They also ignored without comment references to Judge Roy Moore's monumental erection in the rotunda of the Alabama Supreme Court building.","That is what supersport is hoping to do... However, assuming that you are correct in your interpretation, he has no chance of doing it so well.",2
"2142","But this isn't really what I was talking about. Creationists always refer to ""random chemical reactions"" as if there was anything random about chemical reactions. If two molecules react, the product is not random, but very determined by thermodynamics.","I see now, sorry. Yes you are right: chemical reactions are not random. Simple reactions will be easy to determine precisely. More complex reactions will be more chaotic, but they still will not be random.",2
"67061","Evolution is supposed to be science, and is said to not address religion.","And the scientific papers don't. The problem here is that creationists don't read the scientific papers. In fact, most can't even understand them.",2
"17191","I have some questions for everyone here. For example, what is each side trying to prove?
 Are the evolution supporters trying to convince others of evolution, or are they trying to defend evolution?
 Are the creationists trying to disprove the current theory of evolution, or are they trying to win converts?
 Also, why do you believe what you do about the universe? (""The other side is wrong"" isn't the real reason you to believe what you do, I would think)
 
 Here are my answers:
 I am here because I enjoy debates, and I am trying to defend evolution from people who don't understand it.
 I believe that there is no god because I see no compelling evidence. I was brought up without anyone telling me what to believe, though I went to church occasionally. I also read the bible, but this failed to convince me. Finally, I wonder why the bible has convinced some but not others.
 
 I hope this thread proves informative.","That is about the same for me (although I never went to church), and I find it more of an intellectual stimulation, and I can learn a lot too",2
"7990","As of today, 11-08-04, the Cobb County (GA) school system is being tested in court about the validity of their warning sticker pasted in every Evolution textbook. The sticker basically says that evolution is a theory and should be approached with an open mind.
 
 The evolutionists are saying this is an endorsement of creationism, therefore is a religious doctrine being taught in school...against the law.
 
 This is the same school system whose leader recently tried to have the word ""evolution"" deleted from the school curriculum.
 
 Is the Bible Belt getting too tight?","Yes, it is. I'm actually considering moving out of the south specifically for that reason. I will miss the largemouth bass fishing....wth is a pike? ;) It's always been that bad though, now that I think about it. It's just I ignored it more when I was younger.
 
 The sticker is moronic IMO. If they label ""evolution"" with that, they should go ahead and label every single book, TV, everyone's forehead, and every object that can hold a sticker in the entire world. Some people thing there is ""openess"" about being correct or incorrect. On some things that are opinion, sure. On reality? Not the case.
 
 I mean, I'm not running around believing John Kerry actually won the election despite the evidence, although I certainly could, if I approached the election results with ""an open mind"". Although I could....hmmm...just have to keep it up for 4 years!
 
 -Mach",2
"34951","While ALL gods can not be shown to exist, it can be pretty conclusively shown that certain gods do not exist. For example, pretend there was a religion...","Obviously that is the case. We cannot simply say that a certain God exists and have it be so.",2
"3066","Just wanted some peoples opinions","I think it's true. Why would someone make that up and pass it off as a real event?
 
 I think the continents probably started separating some time after that, which is how God separated the people.",2
"401","It becomes more and more clear why atheists are comfortable with theistic evolution. If there was no Adam, there was no original sin, and no genealogy as described in the book of Genesis, only monkeys. Except for his amazing exception to science in the virgin birth of Jesus, he seems to allow evolutionistic pronouncements to have priority over Biblical statements. Then ALL the basics of Christianity, the nature of God and central New Testament teachings, including the way the sinner Adam (one man)and the Savior Jesus (one man) are linked together in Romans 5, 16-18, are trivialized just the way atheists love. No wonder they're so comfortable with theistic evolution!","Actually, you could probably make your point better if you referred to a ""theistic evolutionist"" who rejected all creation stories (and other history) in the bible.
 As for your point itself, it is fairly correct (in my opinion). Theistic evolution makes no assertions that contradict either evolutionary theory or the teachings of the bible (morals, etc.). This presents no problems for atheistic evolutionists.",2
"90812","If anything it should be their creation stories of the Sioux, etc. that should be taught over that of Christians (the invaders and slaughterers of the indigineous people).","Oh, we could let them in I guess. How much room would it take up in a textbook, two pages maybe?",2
"1043","2) The global flood should have left homogenous sediment layers across the world, similar to the Iridium layer that the asteroid that wiped out the dinosaurs left on the Earth. No such layer of sediment exists for that time period.","I see I jumped the gun. That was well stated.",2
