"","quote_text","response_text","relation"
"2034","How can absolute, conceptual, abstract laws be derived from a universe of matter, energy and motion?","Stated above.",1
"9456","i mean jesus christ (pun intended)... look at what you posted in response to ""i believe in the teachings of jesus christ."":
 ""that's a vague statement.""","Jesus Christ! (Pun intended) That's not anger, I'm saying that he made a vague statement and he should elaborate on it. Someone could believe in some of the teachings of Jesus, but not be a Christian. Someone can believe in everything Jesus said except for him being the Son of God, and not be a Christian.",1
"77","Your quiz consists of two multiple choice and an essay question. Let's begin:
 
 1. Jesus was:
 A. a myth; invented by heretical Jews, he never existed.
 B. an ordinary man who attracted a following by performing ""tricks"" and making interesting statements; disengenuos and decieving his followers
 C. an amazing moral teacher, nothing more
 D. a complete madman.
 E. Other (limit your response to 50 words)","1, A. Myth; 
 Whilst there may have been a person leading a Jewish cult that may even have been excuted, none of the miracles have any basis in fact.",1
"5408","But your new language would be meaningless. [cut more XXXX]","Some mathematical definitions can be precise, but then others can be unprecise, because of one little thing a person like you would never be able to understand, and that is, humans are not perfect.",1
"3232","I hope there's a way to leave feedback for the fine folks at Dictionary.com. Atheism has nothing to instruct us in immorality.","And I have left them feedback to see what happens. I noticed this particular entry was sourced from The American Heritage® Dictionary of the English Language, Fourth Edition so it is not something Dictionary.com wrote. 
 
 I can see Iuris' point but the entry is still laid out wrong if this is the case. As written, ""Godlessness; immorality"", implies that immorality is synonymous with godlessness but the thesaurus entry for godlessness does not list immorality as a synonym. I think this is because some use the term ""godless"", an adjective, to mean immoral but ""godlessness"", a noun, to mean atheistic.",1
"1320","I have to ask: do you seriously not know, or do you just want him to up and say it?","Oh, I know what he is trying to establish there.
 
 I do want him to own up and admit what he is trying to establish. Don't expect him to, but hey, ""miracles"" happen (according to him). :p
 
 In fact, as a return question, I'd like to ask him: does someone rely on the Odyssey to establish the existence of Pallas Athene, Circe or Calypso ?",1
"9597","Surely this question be easy enough to answer. 
 
 Any rational thinking thiest want to give my question a shot?","Well I'm neither rational nor a theist, but still!
 
 I could put in a comment about what I personally believe the nature of God to be, but I'm sure you've all heard it before so I won't bother!
 
 In the end I don't think it is an easy question to answer, it is asking to define the undefinable. Humans are limited creatures, we can give a dictionary definition of these things, we have a rough idea of the concept of infinity but can never begin to truly comprehend or define it.",1
"6806","Objective Moral values","Well, we can go through a list from Live human sacrifice, infraticide, slavery in the Roman empire, to sexual morality, and the treatment of Wmen - Mother's and their children.
 
 We might need a new thread for this topic!
 
 Most elucidating, and worth quoting is:
 
 In the Syballine Oracles, written by an Egyptian Jew probably between 163 and 45 B.C., the author compared Jews to the other nations: The Jews 
 &#8220;are mindful of holy wedlock, and they do not engage in impious intercourse with male children, as do Phoenicians, Egyptians, and Romans, specious Greece and many nations of others, Persians and Galatians and all Asia.&#8221; 
 
 And in our times, sex historian Amo Karlen wrote that according to the sex researcher Alfred Kinsey, &#8220;Homosexuality was phenomenally rare among Orthodox Jews.&#8221; 
 
 To a world which divided human sexuality between penetrator and penetrated, Judaism said, &#8220;You are wrong &#8212; sexuality is to be divided between male and female.&#8221; 
 
 To a world which saw women as baby producers unworthy of romantic and sexual attention, Judaism said, &#8220;You are wrong &#8212; women must be the sole focus of men's erotic love.&#8221; 
 
 To a world which said that sensual feelings and physical beauty were life's supreme goods, Judaism said, &#8220;You are wrong &#8212; ethics and holiness are the supreme goods.&#8221; 
 
 A thousand years before Roman emperors kept naked boys, Jewish kings were commanded to write and keep a sefer torah, a book of the Torah. ....nothing moved me more than the Talmudic law that Jews were forbidden to sell slaves or sheep to non-Jews, lest the non-Jews engage in homosexuality and bestiality. That was the world in which rabbis wrote the Talmud, and in which, earlier, the Bible was written. Asked what is the single greatest revelation I have derived from all my researches, I always respond, 
 i &#8220;That there had to have been divine revelation to produce the Torah.&#8221; 
 
 The Torah was simply too different from the rest of the world, too against man's nature, to have been solely man-made. 
 
 The creation of Western civilization has been a terribly difficult and unique thing. It took a constant delaying of gratification, and a re-channeling of natural instincts; and these disciplines have not always been well received. There have been numerous attempts to undo Judeo-Christian civilization, not infrequently by Jews (through radical politics) and Christians (through anti-Semitism). 
 
 The bedrock of this civilization, and of Jewish life, has been the centrality and purity of family life. But the family is not a natural unit so much as it is a value that must be cultivated and protected. The Greeks assaulted the family in the name of beauty and Eros. The Marxists assaulted the family in the name of progress. 
 
 Judaism&#8217;s Sexual Revolution: Why Judaism (and then Christianity) Rejected Homosexuality - Click Here",1
"8347","an unbreakable rock cannot exist, simply because its illogical, not because of God's will. as long as something is classified as a rock, or any other solid for that matter, it can break. in the same way God cannot create a round square. 
 
 then again, God can set limits on himself, in that he can create a situation that he himself cannot revoke. in a way it is similar to the hard rock question. for instance, God cannot undo his word. if he says something will happen, or never happen, then it can never be undone. according to genesis, one of the things God cannot do is destroy the earth by water. in this sense, here is something God cannot do. by God's own declarations he limits his possible actions. but it doesnt make him less than omnipotent. he still possesses the ABILITY to destroy the earth by global flood, but he cannot because he cannot lie, and for every declaration he makes, its one more thing he cannot do","Good point.",1
"5233","No matter what religion we are, we are human, we stray, we sin, WE ARE NOT PERFECT. But many religions preach forgiveness for sins. God forgives.","I'm perfect.",1
"9645","They are not the properties of the physical universe (since they are conceptual) ...","I'll give you that, though there is a whole school of debate about what thoughts are.",1
"5519","I don't think that Paul was actively gay. He was so odd about having anykind of sex at all that it was pretty warped.","Oh, what the hell.
 
 As is so often the case, I have a definitive source on this:
 
 http://www.lunaseas.net/gaps/episode9.html",1
"4559","Answers include but are not limited to:
  People need a solution for the Problem of Evil.
  People want to have an ""objective"" standard for good and evil.
  God said it, I believe it, that settles it.","Mormons believe that Satan is the brother of Jesus.",1
"7346","Atheists feel that their views are more than a denial of a God; for them, atheism is also way to find new purpose and meaning in life without confining themselves, or their beliefs, to a set of rules.
 
 Quick fix
 
 Comparative Religions teacher Cherie McGinn has always been aware of atheism among her students, but says that it is often a temporary belief. McGinn feels atheism can often be a ""quick fix"" for students who are still searching or need a way to declare their independence.
 
 ""It's easier to say 'I don't believe in God' than to say, 'I believe in this,"" McGinn explains. According to McGinn, most people who claim to be atheists are probably agnostic, or people who do not believe God's existence can be proved either way. ""It takes a strong level of commitment and understanding to be a true atheist,"" says McGinn.","The ""truth"" about atheism is that it's the only proposition that makes sense (apart from agnosticism ?) to people who conclude, as I do, that religious principles are not based on reason.
 I know it's a bit unusual in a public forum but I'd like to introduce a little personal history here by way of illustration of my path to atheism: I was educated during my most impressionable years (11-18) at a grammar school controlled by the Jesuits. All my teachers were priests and many were of formidable intellect. Every morning began with ""divine service"", every lesson was started and ended with a prayer. At noon we sang the Angelus and at 3.30 in the afternoon we finished the school day with Benediction. We had at least one session a day learning and reciting the catechism - so we could be word perfect in our answers to metaphysical questions. Yet all this religious conditioning failed to arouse any spark of faith in me. Sure, I conformed to all outward appearances, but inwardly I rebelled and I did not believe. So why didn't I believe - because my clergymen teachers gave me no REASONS to do so. When, eventually, during my last days at school I chose to reveal my disbelief - the Rector said, ""Well, after all, faith is a gift from God !"" , and I had received no such gift. 
 Since, in my view, there is no reasoned evidence for God's existence, why succumb to wish-fulfillment ? It's less comforting but more honest to be an atheist.",1
"9962","And you wonder what has prevented me from being in an accident? Well, perhaps the fact that I am a concientious, defensive, and skilled driver who excercises caution while on the road. Maybe next time someone pulls out in front of me, I should just throw my hands in the air and scream ""take the wheel jesus!"" I am sure some magical being will fly down from heaven and save me from crashing. Yeah...sure.","I know there&#8217;s an explanation for everything, that&#8217;s why God isn&#8217;t praised as much as He should be.
 I tend to thank Him for all things. It&#8217;s a habit of mine. I just thought that I&#8217;d throw in my 2 cents worth. No harm intended.",1
"9632","You are assuming that God (if there is one) is not somehow sustaining His creation. Once again, this cannot be proven nor disproven by science as it cannot be tested or observed - as you said in your original topic starting post. But it is reasonable to believe, that if there is a God who created the whole universe, then without Him sustaining it somehow, it would cease to exist - hence, since it does exist, it is logical to believe that He is somehow sustaining it (obviously not as much as He can). So, if true, the observations that we see and/or take, are the effects of God acting on His creation; and miracles can be explained in such a way to say that it is God just acting on a part of His creation in a different way, this is not only plausible but logical.","as far as all observable evidence dictates, the laws of nature are what sustains the universe. there is not one single function of nature that isnt on ""autopilot"" as it were. that is, no function needed to sustain the universe occurs outside of natural law. what's more, nothing that defies natural law (whether universe-sustaining or not) ever occurs in observable reality
 
 
 I'm glad you responded Nu Leader. this is this issue that really hits the religion/science divide. as it is, God has been gradually and subliminally coralled in the spiritual realm. there is absolutely nothing in the physical and observable world that is a function of God, or a manifestation of supernatural power. in other words, in the realm of the physical, God has no turf. even if God does exist, he does not (and by biblical definition, cannot) physically manifest his being nor the effect of his power
 
 this leaves us with the spiritual realm. this realm, whether it exists or not, does affect people. yet this realm is as elusive and intangible as God himself. the same realm that God is believed to abive and reign in, is said to be the same realm that humans enter only when they die. i have many thoughts about the effects of this spiritual realm on reality, but for now i think its sufficient to say that God is limited to the spiritual realm only",1
"1136","as for the proof, its really not a proof at all. if God is defined as a perfect being in reality, that does not mean that God exists. if i define a ufo as a flying spacecraft from another planet in reality, that does not make such things exist. its just a definition. i really dont see how that can be even considered a proof
 
 basically, the definition: ""a being possessing every perfection and every positive attribute"" is not a true definition, because both perfection and positive attributes are subjective. so theres really nothing to work with here
 
 God, by this definition, doesnt exist","Well, according to Descartes, if I have an idea of a most perfect being, I shall distinctly perceive that such a being must contain all perfections - including reality in every degree. So this idea also contains existence. God's essence is to exist, and of no other thing can this be said. (Existence in everything else being contingent.) 
 
 To refute these arguments, and some philosophers doubt they can be refuted, I think you will need to take another tack.",1
"2528","I'd not punish anyone. I don't think punishment does well at teaching children.","Pain is the best teaching tool.",1
"7155","Well, I wasn't an fortunate as you. It took me a few years to see through the fairy tale of evolution and see that God was the only true creator. However, that is a whole 'nother topic.","um, yeah, you could say that... (won't argue... left up to the evolution board)",1
"864","First off this is not an accurate depiction of atheism. Atheism doesn't dictate how the universe was created or what happens after death. It just says that there is no god. Other than that it's up to you to think, use your brain. This is also why the thread title: ""I don't have enough faith to be an atheist"" is not accurate. All you have to do is believe that we weren't created by God. It doesn't in any way relate to evolution, the big bang, etc.","I'm not sure where anyone said it related to evolution, the big bang, etc., but I might have missed something.",1
"6368","It can be the result of the same questionings that scientists have but just on a different plane. Faith and reason are not always perpendicular but they are often times parallel. Because one holds a certain dogma dealing with a particular subject does not mean he is closed minded on every other subject.","Well, that may be true. But the U.S. is blessed with an unusual number of people in which this is not true. One particular brand of christianity that is mostly limited to the U.S. actually rejects science based on mythology. Their religious dogma closes their mind to the reality around them.",1
"9724","Not being able to change something would be an indication of not being omnipotent. Here is another example of your inadequacies.","corrected above, thank you, minus the insult that followed.
 It still stands however as a rational rebuttal.",1
"9083","Can a Deist be a Deist if they are also a soft or hard atheist?","I think deism and atheism are incompatible. A true atheist would have no openness to the idea of a god of any sort.
 
 Agnosticism may be a different story.",1
"8992","Have you read any of Sam Harris' work?","No, but I agree with him that we should all be able to find our own spirituality without the religious hound dogs tracking us down.
 I don't think he would agree with how you and others approach the religious posts in this forum either.
 
 Even though I don't agree with everything I read of him, which is not much, I do think he's on the right track. I hope he can find the answers he's looking for. Who knows, he may even be able to find a cure for stupid.",1
"8637","3 And God said, Let there be light: and there was light. 
 
 4 And God saw the light, that it was good: and God divided the light from the darkness. 
 
 5 And God called the light Day, and the darkness he called Night. And the evening and the morning were the first day.","After God had ""created"" the lights, that means when the lights can't pass through an non-transparet object , there's a shadow and gone ""darKness"" , but the ""one"" who wrote the bible should be God but seemed didn't know this phenomenon , that ""writer"" said : God had to ""divide"" the light from darkness. 
 
 emoticon_confused emoticon_confused emoticon_confused 
 
 That prove:- the writer was just someone who didn't have that scientific knowledge in the old days. 
 
 Do you agree ???",1
"4365","For your info just a many Democrat go to church as well so whats that suppose to mean too. Come on Satin get with the real world. emoticon_rolleyes","Actually, I reported the real results of a study. Regular church attendees are twice as likely to vote Republican...etc., the conclusion was, however, meant to be a joke. Most got it, you didn't. emoticon_rolleyes",1
"9668","""There is far more proof needed to reasonably believe what's asserted in the Bible than there are for most things. ""Extraordinary claims require extraordinary evidence"" - Carl Sagan. I think that statement really is true. Just imagine a couple statements I could make and what the proper reactions should be to them.
 
 
 
 1. I was sitting in my room last night and I got a call from a friend of mine.
 
 The normal response is ""ok"". Everybody has phones, most people have friends, people calling their friends is a very normal thing to do... if this is the only statement I make about that call, there's really no reason for anybody to question the validity of it.
 
 
 2. I was sitting in my room last night, and a stranger wearing a black trenchcoat came and knocked on my door.
 
 This statement should be questioned somewhat. A person wearing a black trenchcoat during the summer in Florida is odd, but not the craziest thing anyone's ever seen probably... it does need to be explained though.. more detail is needed to conclude that this probably did happen. I should be able to explain the reason this happened adequately for somebody to believe that this actually happened.
 
 3. Last night I was sitting in my room and the walls started bleeding, then several of our founding fathers' ghosts walked out of my closet and told me it was my mission to make sure that church and state remain seperate.
 
 Everyone that hears me say that, should automatically say ""no"", until I provide some amazing, concrete proof of that. We know about the physical makeup of my bedroom walls, they can't bleed. The idea of ghosts from the past coming to visit people I would imagine is 100% foreign to just about everyone... so nobody's word should be taken on that either.
 
 
 
 This is the problem with the resurrection and miracles of Jesus... believers think we should believe it's true and just give it the kind of inspection like in number 1 or maybe number 2, but they're things that nobody living today has actually witnessed anything similar to... it defies the laws of science and nature to the extent that we know them... and the closest evidence we have of them is a couple eye-witness accounts (questionably), which weren't even written within 15 years of his death. There is no rational basis for believing it based on this... ANY feasible explanation that falls within the realm of reason and nature should ALWAYS be taken over any explanation which turns to the supernatural and irrational.""
 
 -mD","Well, I suppose that the reply it took me almost 5 minutes to type, a couple more to check and a couple to correct will not suffice now.",1
"489","I thought of somthing sunday, as I was teaching sunday school (I know shocking),","You aren't serious are you??? Is this a joke? You're one of the most active attackers of Christianity in these threads. Aren't you the one that likes to use the term ""Christonazi?""",1
"4702","Abram, I would suggest you study cognitive processes and the evolution of both the human body and the human mind. We take reality and describe it in our minds and thus form it into abstract concepts which we can operate with. Or, for more fun, just read a few articles on camouflage. You'll see that you don't become invisible by looking exactly like your surroundings, but by simply not looking like anything at all to the observer's eye.","Iuris, there is something, I want to say something Zenlike in this statement--but I am not sure.",1
"7261","From another thread:
 
 
 The head of the Federal Emergency Management Agency is directing people wanting to contribute to give to the Christian charities above. Again, where are the atheist organizations?","Well, who was the head of FEMA appointed by? A brief googling seems to suggest a Mr. G.W. Bush was responsible, it wouldn't be entirely out of the question for dubya to appoint another member of the Christian right to this permission, who might be keen for Christian charities to be promoted. Other possible reasons are that religion is very strong in the south, and hence religious charities are more likely to have resources in the south, were the problem is.
 
 In any case, the red cross is by far the largest organisation involved, and as has already been estalbished is secular. And as I said before just because the organisations are Christian doesn't necessarily mean that their workers or contributors are.",1
"1561","I like your thinking, although I disagree with it. You say that God is the universe. I propose that God is relational. That without a relational god we are truly hopeless. The problem you are running into is that you are trying to imagine god existing within the framework of creation (universe etc.) and tying his existence to that. NOw I am going to say something that will really not make sense to you. God existed BEFORE time. Chew on that one a bit. Eternality implies an existence outside of time. And in fact, much of science alludes to this possibility. I certainly could never prove it and do not propose to but would like it if you would consider the implications.
 
 As for God communicating to us, there is nothing that prevents that. Especially if you accept the idea that we are imago dei, image bearers of the divine. We are not perfect images but we are rational, emotional, spiritual, beings
 
 EF","""Before time""? Does that phrase have any meanng? That is sort of like saying something is north of the north pole. It is symantically meaningless.",1
"7045","What if my own words and feeling sound just like that dusty book? What if I happen to agree with it? What if I take it in context? Actually one would be hard pressed to show where I have ever taken it out of context.
 
 If I say that I worship Him because he is powerful, beautiful and has loved me greatly, does that mean you now get to argue those points and say he is not any of those. I would say you do not get to argue my assumptions about God as they are mine. YOu may argue my conclusions based on my assumptions but you could not argue my assumptions, nor I yours. 
 
 Is that a fair statement of how to answer the question?","It's a lot more interesting for us to read if it is in your own words.
 
 If I wanted to read a bible, I'd steal one.",1
"3010","2. The resurrection story of Jesus is:
 A. a myth - see answer 'A' above.
 B. a legend that grew over time, well after anyone could have proven the legend false.
 C. a lie fabricated by his followers immediately after his death
 D. an honest misunderstanding; the Jews lost the body and were embarressed to admit their mistake while his followers were hallucinating
 E. Other (limit your response to 50 words)","2, A. Myth;
 Complete fabrication.",1
