"","quote_text","response_text","relation"
"731","These people sound more like a cult than religion.
 
 They should be declared a public nuisance and the police should be called whenever they picket any funeral. 
 
 What about respect for the dead? In my view they should have a law banning pickets and demonstration within sight of graveyards.","And I believe they should ban religious speech the defame gays or ban religion all together as a public nuisance and protect the public from its drug like effects. I understand, however, that to restrict others freedom of speech of one group today, might mean that my freedom of speech could be restricted tomorrow.
 
 
 They have the right to free speech even free speech, I or anyone else diagrees with. This does not mean that I think that they do not have to take responsiblity for the speech. With freedom comes responsiblity. The law suit for pain and suffering, I think is just.
 
 Oh so many law suits to plan. Because with freedom of religion and religious speech comes responsiblity. This case now sets Precedent, that if I find religious speech hurtfull, or the actions of religious groups trying to fight gay people, marriage, or gay rights, I could sue for pain and suffering.
 
 God bless Fred Phelps for giving fundies and religion a black eye. :) Fred Phelps is the one of the best things ever that could happen for gay rights. GO FRED.",1
"5345","The mentally disabled are not able to drive. They depend on level-headed, indiscriminate folks like you and I to do that...and most everything else for that matter. Don't forget who depends on whom.
 
 I wonder what that wonder was? Hmmm...","Well, it depends on your definition of retarded I guess. The standards to get a drivers license are really not that high. Think of how dumb the average person is, and realize that 50% of people are dumber than that. Kinda makes you cringe. 
 
 And you wonder what has prevented me from being in an accident? Well, perhaps the fact that I am a concientious, defensive, and skilled driver who excercises caution while on the road. Maybe next time someone pulls out in front of me, I should just throw my hands in the air and scream ""take the wheel jesus!"" I am sure some magical being will fly down from heaven and save me from crashing. Yeah...sure.",1
"8142","Over 100 Million dead in Germany, Russia and China.","You can have Russia and China, but Hitler was very much a ""christian.""",1
"3286","I do not see any problem with the Jehova's or any other's idea of a scriptural account. Once the debate has begun, I will not make another post until the end.
 
 One week sounds reasonable - you might want to post within a shorter gap later on, but that will be up to the person posting. You should both be able to post in your own time. A week is sufficient, I should think.
 
 I recommend that no limit be placed on posts, but that it is recommended that posts stay generally smaller. It's far more challenging to be succint than to write gallons. One more tip: it's a good idea to, in your first posts, include definition so that terms might be clarified, and it avoids later, unecessary hassle. 
 
 If we just wait for Hank's clarification on those few points, then we can then begin!","I know this would be somewhat of a drain on your time but I think it would be helpful if you would make a short post at the end of each post stating how much time the next poster has, what post number this is, how many are left, any comments concerning going outside the rules, etc.",1
"3625","No, because 2+2= 4 if you agree with it or not.
 
 It's a concept that is not dependent on man to agree with it.","That's EXACTLY the point. Regardless of whether or not human minds think differently, whichever mind produced and agrees that 2+2=4 is absolutely correct, the rest are wrong. 
 
 We know this because we can observe and test the concept in the physical world and prove that it is true. 
 
 This goes for just about anything, dissention in the face of facts does not change the facts.
 
 IMHO, this invalidates your claim that something produced in the human mind is not absolute due to some human minds being contradictory.",1
"5358","Just a word of advice. If you stopped doing all those stupid things with font size and color some people, me included, might give your posts more serious consideration. If you need to be ""clever"" in your presentation to get your point across then your point can't be all that well formulated.","-------------------------------------------------------------------
 First of all.... I agree, in retrospect, that the font size was too large in this particular post... Therefore, I have changed it.
 Second.... I thought the content was more important, than the font size.:xcensored 
 THIRD......WHAT COLOR are you talking about the original post??? :xbanghead 
 Forth..... What is it with your attitude? It would have been nice if you had just sent me a private message INSTEAD. This would have been appreciated. Because it is not my intent to have people NOT read the post due to font size problems.
 Fifth..... You have a problem with larger font sizes & color??? Maybe write to 4fourmns and tell them they should remove the color & font options!!!! emoticon_xkill emoticon_xkill emoticon_xkill",1
"8600","What does this mean in terms of proving their existence? Since their interactions with us are outside the realm of science, science can't really say anything unless the dieties in question specifically choose to interact with us in a way which science could verify. That is to say, the existence of any God can't be proven against that God's will, but I believe that if a diety wanted to have it's existence known than it would certainly be able to do so.","yes, but if we cannot even observe the effects of such a deity, what difference does it make to man whether such a God exists or not? for now, i think we can comfortably conclude that this deity, if he exists, doesnt want to have his existence known. furthermore, this deity doesnt seem interested in interacting with mankind in any physical sense. what good is such a God? whether he exists or not holds absolutely no bearing on reality.",1
"9357","How do you know if they WANT to believe in a deity? They simply don't.","and the others don't want to believe (hope there isn't) a god",1
"9807","Bonus Question:
 We don't know. We credit Homer for the silly reason that a blind guy telling epic stories makes for good imagery. The stories were likely oral traditions passed along and embellished repeatedly.","Why then is this not taught in history classes? Why are we taught AS FACT that Homer wrote them?",1
"1165","A curse? If you don't agree with it that's one thing. Many people have died because of Christianity.","Bad Religion or misapplied Religion has been in every century, country and culture.",1
"3012","if the laws of logic are human constructs then how can they be absolute since humans think differently and often contradictorily. If they are produced from human minds, and human minds are mutually contradictory, then how can the constructs be absolute? Therefore, the laws of logic are not human constructs.","very true. logic exists whether people are there to grasps its concepts or not.
 
 where we disagree is at your assumption that god created logic. how can this be? logic is not contingent on any intelligent entity, whether it be man or god, to exist. the logic of increasing a quantity by adding to it would remain whether god existed or not. you have yet to tie the existence of logic to god as its cause",1
"6895","If God is a forgiving one, why is there the Devil?","Because Satan is a fallen angel. He had a chance to be with God, but he didn't take it. He could go back to God any time he wanted to, but he doesn't want to. He has free will. God won't take that away, even though He can.",1
"1167","I might start another thread, and change the subject to:
 
 I'm Not Dumb Enough to Be an Agnostic!
 
 Oh well, at least it represents a more illectually honest position than Atheism!","I've tried to be ""intellectually honest"" with you as well as patient with your ""fuzzy"" thinking and propensity to paste and interpret.",1
"326","Well? Let's get to it. Why do YOU believe?","I believe in that which is. Because to believe in anything else is ultimately pointless.",1
"7875","I believe in the teachings of Jesus.","That's a vague statement.",1
"6877","You keep bringing up the Red Cross. The majority of donators to the Red Cross are most likely Christians as well, so what's your point? emoticon_confused","But is the Red Cross Christian? Obviously most contributors are Christian. That's obvious as most Americans are Christian.",1
"1369","Faith by definition is a belief without evidence.","yes.
 
 But then you throw in ""reasoned faith"". But then you are making up terms that try to show faith as reason. What is reasoned faith? If reasoned faith is the same as ""reason"", then fine, you aren't using faith. If it's faith, belief without evidence, then your evidence is your faith, and thus, it's circular.
 
 If your faith is even part of your ""evidence"" or ""reason"" for belief, then logically the entire claim is arrived at through circular reasoning. You can use both all you like, I'm just letting you know it's fallacy to claim faith as evidence, which you do. If you do not, then you are using reason, and not faith, and we don't need to continue because I see no fallacy in using evidence to back your claim.
 
 Enjoy.
 
 I found this as well, maybe it will be worded in such a way that you understand, since you seem to reject my arguments based on my name.
 
 http://rous.redbarn.org/objectivism/Writing/JoelKatz/answers2.html",1
"4936","2. The resurrection story of Jesus is:
 A. a myth - see answer 'A' above.
 B. a legend that grew over time, well after anyone could have proven the legend false.
 C. a lie fabricated by his followers immediately after his death
 D. an honest misunderstanding; the Jews lost the body and were embarressed to admit their mistake while his followers were hallucinating
 E. Other (limit your response to 50 words)","A.",1
"6714","Many on the religious right claim a belief in the existence of Satan and blame him for many of the evils in this world. I am curious why people believe that Satan is responsible for those evils, not men and their weaknesses. If you believe that Satan exists, can you give a specific example of some human event where you think he had to have played a role?","Oh, we already know a bunch of events that he played a role in. They even made it into a song!
 
 Please allow me to introduce myself 
 I'm a man of wealth and taste 
 I've been around for long, long years 
 Stole many man's soul and faith 
 
 And I was 'round when Jesus Christ 
 Had his moment of doubt and pain 
 Made damn sure that Pilate 
 Washed his hands and sealed his fate 
 
 Pleased to meet you 
 Hope you guess my name 
 But what's puzzling you 
 Is the nature of my game 
 
 I stuck around St. Petersburg 
 When I saw it was a time for a change 
 Killed the Czar and his ministers 
 Anastasia screamed in vain 
 
 I rode a tank 
 Held a general's rank 
 When the blitzkrieg raged 
 And the bodies stank 
 
 Pleased to meet you 
 Hope you guess my name, oh yeah 
 Ah, what's puzzling you 
 Is the nature of my game, oh yeah 
 (woo woo, woo woo) 
 
 I watched with glee 
 While your kings and queens 
 Fought for ten decades 
 For the gods they made 
 (woo woo, woo woo) 
 
 I shouted out, 
 ""Who killed the Kennedys?"" 
 When after all 
 It was you and me 
 (who who, who who) 
 
 Let me please introduce myself 
 I'm a man of wealth and taste 
 And I laid traps for troubadours 
 Who get killed before they reached Bombay 
 (woo woo, who who) 
 
 Pleased to meet you 
 Hope you guessed my name, oh yeah 
 (who who)
 But what's puzzling you 
 Is the nature of my game, oh yeah, get down, baby 
 (who who, who who) 
 
 Pleased to meet you 
 Hope you guessed my name, oh yeah 
 But what's confusing you 
 Is just the nature of my game 
 (woo woo, who who) 
 
 Just as every cop is a criminal 
 And all the sinners saints 
 As heads is tails 
 Just call me Lucifer 
 'Cause I'm in need of some restraint 
 (who who, who who) 
 
 So if you meet me 
 Have some courtesy 
 Have some sympathy, and some taste 
 (woo woo)
 Use all your well-learned politesse 
 Or I'll lay your soul to waste, um yeah 
 (woo woo, woo woo) 
 
 Pleased to meet you 
 Hope you guessed my name, um yeah 
 (who who)
 But what's puzzling you 
 Is the nature of my game, um mean it, get down 
 (woo woo, woo woo) 
 
 Woo, who 
 Oh yeah, get on down 
 Oh yeah 
 Oh yeah! 
 (woo woo) 
 
 Tell me baby, what's my name 
 Tell me honey, can ya guess my name 
 Tell me baby, what's my name 
 I tell you one time, you're to blame 
 
 Oh, who 
 woo, woo 
 Woo, who 
 Woo, woo 
 Woo, who, who 
 Woo, who, who 
 Oh, yeah 
 
 What's my name 
 Tell me, baby, what's my name 
 Tell me, sweetie, what's my name 
 
 Woo, who, who 
 Woo, who, who 
 Woo, who, who 
 Woo, who, who 
 Woo, who, who 
 Woo, who, who 
 Oh, yeah 
 Woo woo 
 Woo woo 
 ~Sympathy for the Devil; by the Rolling Stones
 
 :) ;)",1
"9623","The ""truth"" about atheism is that it's the only proposition that makes sense (apart from agnosticism ?) to people who conclude, as I do, that religious principles are not based on reason.
 I know it's a bit unusual in a public forum but I'd like to introduce a little personal history here by way of illustration of my path to atheism: I was educated during my most impressionable years (11-18) at a grammar school controlled by the Jesuits. All my teachers were priests and many were of formidable intellect. Every morning began with ""divine service"", every lesson was started and ended with a prayer. At noon we sang the Angelus and at 3.30 in the afternoon we finished the school day with Benediction. We had at least one session a day learning and reciting the catechism - so we could be word perfect in our answers to metaphysical questions. Yet all this religious conditioning failed to arouse any spark of faith in me. Sure, I conformed to all outward appearances, but inwardly I rebelled and I did not believe. So why didn't I believe - because my clergymen teachers gave me no REASONS to do so. When, eventually, during my last days at school I chose to reveal my disbelief - the Rector said, ""Well, after all, faith is a gift from God !"" , and I had received no such gift. 
 Since, in my view, there is no reasoned evidence for God's existence, why succumb to wish-fulfillment ? It's less comforting but more honest to be an atheist.","I'm an atheist pretty much the same reason you are an atheist (except for going to a religious school.
 
 I didn't really think it was fair and balanced at all. It protrayed atheists as lost from the true path. The reasons it gave for being atheist were they hadn't found god yet, and a tradgedy. What about logically thinking about it? And a RELIGIOUS STUDIES teacher says that atheism is just a phase? They also say atheism is the easy way out. I think it's easier to just believe in a god and be comforted. I'm not saying people do but I'd say Christianity is more of a quick fix than atheism. All you have to do is believe in god and you're safe for your life and afterwards. Most Atheists don't believe what they do just to rebel or haven't found God yet. Mostly it's because they realized that there is no logical proof (enough for them) that there is God. They also said incorrectly that atheism isn't a religion.
 
 
 re·li·gion [ri líjj?n]
 n 
 1. religion beliefs and worship: people?s beliefs and opinions concerning the existence, nature, and worship of a deity or deities, and divine involvement in the universe and human life 
 
 Microsoft® Encarta® Reference Library 2003. © 1993-2002 Microsoft Corporation. All rights reserved.
 
 Wouldn't you say the belief that there is no god and when we die we die qualifies as this?",1
"650","If Jesus existed, was crucified and died for us, why do you take that bit literally when you've already stated the contrary?","Yes and no",1
"8297","Good Lord, grow up. I believe in him, you don't, that makes you feel superior because we believe in the tooth fairy and you don't, blah, blah, blah, invisible guy in the sky, etc, etc. I've heard it all before...a THOUSAND times. This thread is obviously for people who DO believe in God, so take the programmed parrot talk elsewhere.","""One day you're going to realize that you're ""evangelizing"" and ""witnessing"" have pushed far more people away from religion then has brought them in.""
 
 ""You're not telling people about God, you're guilting them and putting them down. You're drawing an imaginary line that separates ""us"" from ""them"", and you're cutting yourself off from other people. When Jesus ""evangelized"" (I believe with all my heart he would hate that word), he made honest friends, not with the purpose to ""convert"" them. He didn't hand them a track and scare them into being a Christian. No wonder people hate Christians, for God's sake I'm starting to hate Christians.""
 
 Maybe you should follow your own advice...
 
 jim:
 
 Yes, God loves Saddam but He hates the way he is acting.",1
"5605","Hell isn't even based on actions, but on belief and the people who are sent there do not recieve a lesson nor a chance to correct themselves.","Eternal damnation is the punishment of sin.",1
"2302","Matthew 5:17
 
 Think not that I am come to destroy the law, or the prophets: I am not come to destroy, but to fulfil.KJV","So Joe, do you eat pork? How about shrimp?",1
"4542","(this is satire by the way)","And a good one at that. I can hear the wheels a-spinnin&#8217; :)",1
"427","We're all quite impressed with your knowledge of third grade insults, unfortunately, this is not debate.","Thank You. You know how much I love to impress people.",1
"588","Upon what basis would discussion be acceptable if not scripture? If we are to debat the topic, what sources for informational purposes do you consider as ""authoritative""?
 
 EF","A rational mind.",1
"9059","This Pauline gospel of a dying and rising savior bore unmistakable similarity to many of the Greek and Roman mystery cults which had similar stories. Paul's description of the eucharist as a Christian mystery lent further support to this view. But there were notable differences as well. (Paths of Faith: Fourth Edition, John A. Hutchinson, McGraw-Hill, 1991, p417)","Well, the claim isn't that they were identical, just that they preceded Jesus and were very similar.",1
"733","The thing is, though, god and humans aren't the only candidates. Mach illustrated this point in the first post. Ogres, vampires, ghosts, etc. are all other possible candidates. That said, change ""God"" to ""ogres"" and the argument proves the existence of ogres.","I see, thanks for answering my question.",1
"6701","Well, Satan was invented to explain why there is evil in the world.. the dualism. He was adopted by the Hebrews under the influence of Persia. However, in the Jewish religion, Satan is not this incredilbly evil being out to corrupt souls, but rather just an angel (who had no free will), whose job it was to provide for bad choices so that people may choose GOOD ,and thus live more sanctified lives by their own actions.","A Jungian might suggest such a stance. In other words, one (good) cannot exist without the other (evil). 
 
 I wonder what some of our more interesting christian friends (AA, GC) might have to say about such?",1
"1978","Which then would NOT be omnipotent/omniscient.","Our definition of omniscient does not include virtual. That tells me that omniscient means having infinite knowledge.",1
"3574","Possible, if you read the bible. God told Moses he could overcome the Egyptian Gods. Never did God say any other God where False.
 
 For I will pass through the land of Egypt this night, and will smite all the firstborn in the land of Egypt, both man and beast; and against all the gods of Egypt I will execute judgment: I am the LORD.","The god of Moses was a pretty nasty guy.",1
"6551","Second, the majority of the world believes there is a god, and the others don't want to believe (hope there isn't) a god","How do you know if they WANT to believe in a deity? They simply don't.",1
"7733","that's right, i don't want ANOTHER parental figure to tell me what to do, when to do it, and how to do it.","Of course you don't. It's the natural humanistic way of thinking.",1
"8918","i didnt mention good anywhere in my post
 
 
 this is totally false. the laws of logic being absolute does nothing to support a case for god. in fact, everything the bible tells us about god's nature indicates that god is illogical, unpredictable, unreliable and irreplicable. this is totally the opposite of logic","Your making a bunch of arbitrary statments.",1
"1870","Was incest okay back then?","Well, how else were they supposed to reproduce?",1
"9953","1. Jesus was:
 E: a man who probably existed, perhaps even with good ideas about living. Stories about Jesus were embellished with ideas stolen or adapted from other religious and cultural stories.
 
 
 2. The resurrection story of Jesus is:
 E: Complete bunk with no reliable supporting evidence.","Thank you for your response.",1
"8617","I have been asking that for 10 years now and get a lot of different answers Haaa Haaa When you can find someone that is lodgical about the subject you will find out but until that time it is like looking for a needle in a hay stack.","Surely this question be easy enough to answer. 
 
 Any rational thinking thiest want to give my question a shot?",1
"354","Actually the Apocrypha is made up of pre-Christian texts, and late 4th century is a bit of a stretch for the new testament, certainly all its component texts were widely accepted by the 2nd century. I don't whether it is ""generally accepted"" that the text was altered, it seems to me that you are projecting your own views based on the hypotheses of some scholars on to Biblical scholarship in general.","While the current cannon was 'accepted' by the late second century, there were numerous other 'gospels' that existed by then, and were eliminated at the 4th century time frame. Most of those copies were destroyed, but some have been unearthed.",1
"7547","Ness,
 Do you embrace the theology of Christianity, the morals, the ritual? What component?","I believe that science explains the way God created the universe.",1
"1209","#1 What does intelligently mean?
 #2 What does designed mean?","You know, I'm thinking of suggesting that they put a permanent link to an online dictionary on this forum. 
 http://dictionary.reference.com/search?q=designed
 
 You could take ""intelligently"" to mean that the being is conscious of what it's doing; that it's doing what it is purposefully.",1
"6247","So why have we a abandoned so much of the old testiment law? Stop eating pork, cutting your hair, shaving your beard (especially you girls), unless of course you just wish to adhere to those laws that are convenient.","Well there's a new Covenant / Testament. But Jesus declared all foods clean so you can have your pork. Check for trichinellas, which is probably one reason it wasn't on God's preferred list in those unsanitary times.
 
 Recommended study for you: Investigate the different kinds of laws (i.e. moral, civil / tort, ceremonial, dietary). Then look at how these issues are treated in the NT.",1
"5353","...that the notion of the universe created by a being ""resembling a man but magnified in every respect, an idealized superman"", reflects the gross ignorance of primitive peoples.","And that belief in God is further:",1
"4053","This is why the title is ""God exists!!! (but he's not who you think he is). It's a funny proof which I don't think Christians would agree this definition was God. But basically it's saying that take the set of all human beings. Call the greatest God. God exists.
 Not only that, but the final conclusion is one of the premises. The proof is one big circle :)","Thanks: your contributions to this thread throw more light on the subject than
 anybody else's. However, not sure that believers in any religion in which
 supernatural agencies are worshipped would be happy with the inclusion of
 ""God"" among the set of human beings - unless Jesus Christ was both a 
 man and God which I think is a Christian doctrine.
 I suppose I started out reading this particular thread expecting to discover
 a non-circular logical argument that would ""prove"" the existence of a God -
 and found nothing of the kind. I now think my questions on the matter 
 have been rather stupid and naive.",1
"7553","it's rather rude not to","Why?
 
 ......",1
"9606","If no, why take cognisance of any of it?","Yes and no",1
"5791","simone Why would you want to prove your belief system to be true?","Well, it happens in virtually every thread.
 Some disagreements are between individuals of essentially the same basic system [Protestant Christian vs Protestant Christian], [atheist rationalist vs atheist rationalist]. 
 
 Many disagreements are between individual of differing belief systems. In such cases the individuals often use the same word to mean two different things.
 
 What is ""evidence""? Well, that will depend on your core belief system. Sacred writings may be excellent evidence for your belief system, but when you say the Qu'ran proves an issue, the Christian says ""That's not evidence!"".
 One side tries to convince the other side that their core beliefs are incorrect, so they really have no evidence for their position.",1
"5962","Logic is a human construct","Read the post before this one.",1
