"","quote_text","response_text","relation"
"8887","A devoutly religious person would disagree with all the statements in the Humanist Manifesto that I highlighted. Would they believe that public policy should be based on things that they don't believe?","Yes. I know of no one who agrees with all government policies, or all of the premesis that they're based on. But we do all agree (or at least almost all) that we need some method for forming those policies. Compromises must be made. A religious secularist could believe, for example, that if we allow religious beliefs to dictate policy than it's just a matter of time before general religious freedom is compromised for all but those who follow the religion of the ruling party. Rather than risk that they would think it an acceptable compromise to have some policies that they don't agree with, as long as they don't actively compromise their faith.",1
"5225","you know how christian are always saying ""it wasn't ment LITERALLY.""","Only the Christians who don't know what they're talking about.",1
"23","The Crusades killed many people just for not converting to Christianity.","Many were ignorant in the ""dark"" ages.",1
"9920","*walks in*
 *looks at posters*
 *notes no fundies have spoken out yet*
 
 Well, it's OBVIOUS that you don't have a discerning spirit and are thinking with your carnal mind. If you'd only have accepted the truth of the undying and never changing word of God, then you'd understand.
 You just gottsta believe first.
 It's as simple as that.
 But, no, you go right on hating God and you'll soon see where that will get you.
 BURNING IN HELL!!!
 
 Hahahah, FOOL!
 You are soo going to roast. In pain. FOR EVER!
 
 But, that's not my words.
 That's Gods!
 
 Me?
 I love you.
 I love you long time.
 Like forever even.
 If only you'd accept Jesus into your heart.
 
 Cause if you did.
 
 You'd see no contradictions in what you posted.
 
 Seriously...
 
 Drink the flavoraid.
 
 emoticon_xbouncer
 
 edit:
 Capitalize, size increase, italicize and underline various parts of my post. Color them some and insert random, out of contest bible passages to support my claims.","I think it's manifestly obvious that I'm a prophet.
 
 Therefore, the question of my diety should also be of little surprise.",1
"5604","As to the law of identity, Jesus is called both the ""Son of God"" and the ""Son of Man""","I believe Jesus actually can be both. Jesus called himself ""the son of man"", and we all fall into that category. Jesus calmed his father was in heaven. Jesus asked his mother, ""Who is my brother or my sister?"" 
 
 How can Jesus be the son of man and yet the son of God? What prayer did Jesus give when asked?
 
 Jesus told those who asked for a prayer from him to pray; ""Our Father, who art in heaven."" Hold up- If we pray, ""our father"", then who are we?
 
 We are the son of man. We are the son of God. Maybe getting to know yourself brings you closer to God than anyone else can. What does being born again mean? All things born have a mother and a father. 
 
 I believe love is logical. And Love is the simple key to understanding yourself and your neighbor. No other key will get you closer to self understanding. Now its logical to say a designer places a little of himself in everything he makes. If this is true then God is in us. Maybe love and a mirror is the best book you'll ever read on the subject of God.",1
"1096","If there is a god COULD he reveal himself?","YES, that is the answer to ""if God really exist NOW"" !
 But the whole world people won't believe to that so simple and TRUE answer !!
 
 
 Jesus was such a Great liar of the world !
 Up to now, still billions of people in the world believe in his lies !!",1
"8807","Essay:
 Site at least two sources that were written within 200 years after the supposed resurrection date of A.D. 33 which support your responses to questions 1 & 2. (limit your response to 100 words) If you cannot provide any source material from this time period, please provide the two earliest sources. (Note, if you can only provide source material from the previous century, you may want to re-visit your answers for Questions 1 & 2)","#1 is above.
 The Jesus myth came out of Hellenistic Judaism already heavily imbued with the ideas of the suffering servant (Isaiah 53) and the son of God subject to a shameful death (Wisdom of Solomon ""Let us condemn him with a shameful death""). Paul refers to the ""archons"", the evil heavenly rulers of the age, as those who crucified Jesus (1 Cor 2:8) and extols the justice of the Romans (Ro. 13:1-3). The earliest layers of Q material do not refer to a death or resurrection (Kloppenborg). No earthly Jesus, no crucifixion, no death. It is all myth, man.",1
"5561","That is very sexist. It is sad that you are ashamed of being male.","Well, actually, I did find it funny even though I'm a male (or at least, I think I am?)...probably because it's a joke and I know I'm not like the stereo-typical male so I can laugh at them.
 
 
 PS, I'm so unique because I'm so humble and would never brag about my bulging muscles, manhood and amazing intellect.",1
"9566","Having troubles getting past step one Simone?
 
 You just gotta try harder to want a God in your life.
 I know that it's more useless than tits on a man but hon, you gotta open your mind and heart up to the uber-natural farces that permiate the other semi-non-existing planes of being.
 And if yer still having troubles wanting to believe, you can send me some money. It seems to help people want to believe if they've paid good, hard earned money for it.
 Something about not wanting to see your investment go to waste...or was it not wanting to be proven to be a fool who fell for a scam...
 But, psychologically putting money on it seems to help you believe.","You have hit on something. But Christ said give all your money away and follow him, but not many believers obey this commandment. Most Christians are very interested in making more and more money. Capitalism and christianity are incompatible.",1
"5943","...how can matter bring about something that is not matter","You mean like music?",1
"6146","churches could shut down and not help strugling people with things like food and bills","Actually just as many atheist help the needy. 
 
 Of course a person would need to be open-minded to realize it. Here is one such atheist charity. If you were open-minded about such things then you would have learned that both Bill Gates and Warren Buffett, who have each individually made the two largest charitable donations in American history, are both atheist (Oops, bet that's gotta kill your argument, huh?) and they can rightly claim credit for spurring many other ultra-rich to also be charitable. 
 
 Ted Turner, the multi-billionaire, has also donated millions to others, and guess what grizzly6626, he's an atheist too! 
 
 George Soros, also a multi-billionaire, financier and philanthropist, has also donated millions and is also an atheist. The list goes on and on. You just don't hear about these people donating because they tend to do these things quietly, and not with a lot of *cough* religious *cough* fanfare.
 
 Didn't mean to wake you up grizzly6626 emoticon_xbye
 
 BTW - many catholic charities are known to turn the needy away. I've heard many accounts about how when some people first got married back in the 1970s, that catholic charities wouldn't help them out because they were not ""good, church-going catholics."" Basically because they didn't go to church every week (and put in their money filled envelope) the Church didn't consider them worthy of help.
 
 You see, it isn't because religion makes people morally better than atheism. Rather, it would be because churches often organize charitable activities and encourage their members to participate, while atheists, simply have no comparable social structure. It's not that churchgoers have a superior moral sentiment, just that because of their increased social structure they naturally have increased opportunity.
 
 There are countless amounts of people who are atheist that donate from the heart. They do not 'band together' into groups like religions do, and they do not advertise their charitable works like religions do, but they donate from the heart just the same. Here is a partial list of many such individuals who just happen to also be atheist. But it goes MUCH further than that though. There are a few organizations formed by atheists for the sole purpose of donating to those in need. One such organization is called S.H.A.R.E. - Secular Humanist Aid and Relief Effort. Here is a recent story about them helping those in need. So, when someone ignorant and closed-minded like grizzly6626 tries to convince you that 'only religions' donate or help those in need, you will now know that it's simply not true, and that people from all beliefs, even those that don't believe in God, help others in need and donate from their hearts, because they know it's the right thing to do for their fellow man in need emoticon_idea",1
"2823","How so...?","I see His presence in the wonderful world around me. I have felt His guiding hand in my life. I know others who have the same knowledge of God.",1
"8121","Hello everyone, first off I'd like to say I'm an evangelical Christian, so of course I believe in Jesus' existence, just as I believe the Word is the infallible Word of God.
 
 I have heard lately of people who actually argue that Jesus did not exist.
 
 I decided to start this thread to see what everyone thinks.
 
 Do you think Jesus existed? Do you think he existed as described in the bible (Son of God, etc.)? If not, why not?
 
 
 Here is my view - the Bible tells me that Jesus existed, and is the Son of God, as well as my Lord and Savior, and that is really all I need to know.
 
 Discuss.","I believe Jesus is a role model for the human race. I believe he is a very powerful idea. But what I do NOT believe is that there was some dude with a beard running around Israel healing the blind and preaching about his God. So, in a sense, I don't believe Jesus was a literal person in the ancient world, but more of a fable. Like Harry Potter is today.",1
"276","I have never received an actual explanation for the doctrine of eternal damnation from anyone I've asked. It is something I struggled with before turning to Atheism, something I tried desperately to rationalize, and was one of the main points that LED to me becoming Atheist
 
 Many Christians claim that their God is omnipotent/omniscient. They claim that their God is a god of compassion, love, and mercy. Yet, with all of this, they claim that God punishes all people who do not accept Jesus as their savior with eternal torment in Hell, i.e. the vast majority of mankind numbering into the billions. 
 
 What possible compassionate purpose can infinite torture have? The punishment doesn't even serve a remedial purpose because the tormented one is not allowed to repent. It's only conceivable purpose (to me at least) is sadism. 
 
 How is this not evil?
 
 This thread is especially so I can her the thoughts of Christians on this and how they rationalize it, but anyone can feel free to chime in with observations, etc.","Well, here is my take on it. I really believe that only the truly evil end up in Hell. Those like Hitler. I think that anyone else goes to heaven - Wiccans, Atheists, Buddhists, etc. - anyone who follows Christ's message of love, tolerance, and acceptance, whether knowingly or not. 
 
 Those who preach hate, and those who act on that hate, like Hitler, the KKK, and any other person/persons filled with hate (sad to say, this seems to apply to our own friend Archie here) are the ones who will end up in hell.",1
"6855","By Reduction to the Absurd:","Yes this is absurd.
 
 All things are subject to the Will of God the Creator. Nothing exists or can exist that is not subject to God's Will.
 
 God is not perfect at everything. God is not perfectly evil either. 
 
 Your analogy is flawed.
 
 Try again.",1
